First,Year,Authors,,,,,,,,,
Rowl and s,Na,"Rowl and s, G. J. and Mulatu, W. and Authie, E. and Dieteren, G. D. M. and Leak, S. G. A. and Nagda, S. M. and Peregrine, A. S.",,,,,,,,,
Ruiz,2015,"Ruiz, J. P. and Nyingilili, H. S. and Mbata, G. H. and Malele, II",,,,,,,,,
Ruiz,2015,"Ruiz, R. M. and Bastiani, C. E. and De Biasio, M. B. and Alegre, E. A. and Ramirez, N. N.",,,,,,,,,
Ruiz-Gonzalez,2006,"Ruiz-Gonzalez, M. X. and Brown, M. J. F.",,,,,,,,,
Ruiz-Pina,2002,"Ruiz-Pina, H. A. and Cruz-Reyes, A.",,,,,,,,,
Runckel,2011,"Runckel, C. and Flenniken, M. L. and Engel, J. C. and Ruby, J. G. and Ganem, D. and Andino, R. and DeRisi, J. L.",,,,,,,,,
Saghafipour,2017,"Saghafipour, A. and Vat and oost, H. and Zahraei-Ramazani, A. R. and Yaghoobi-Ershadi, M. R. and Jooshin, M. K. and Rassi, Y. and Shirzadi, M. R. and Akhavan, A. A. and Hanafi-Bojd, A. A.",,,,,,,,,
Salamanca-Carreno,2018,"Salamanca-Carreno, A. and Tamasaukas, R. and Cesar-Giraldo-Forero, J. and Quintero, A. D. and Hern and ez-Rodriguez, M. E.",,,,,,,,,
Salath√©,2012,"Salath√©, R. and Tognazzo, M. and Schmid-Hempel, R. and Schmid-Hempel, P.",,,,,,,,,
Saldana,2015,"Saldana, A. and Calzada, J. E. and Pineda, V. and Perea, M. and Rigg, C. and Gonzalez, K. and Santamaria, A. M. and Gottdenker, N. L. and Chaves, L. F.",,,,,,,,,
Salda√±a,2018,"Salda√±a, A. and Santamar√≠a, A. M. and Pineda, V. and V√°squez, V. and Gottdenker, N. L. and Calzada, J. E.",,,,,,,,,
Salim,2011,"Salim, B. and Bakheit, M. A. and Kamau, J. and Nakamura, I. and Sugimoto, C.",,,,,,,,,
Salim,2014,"Salim, B. and Bakheit, M. A. and Sugimoto, C.",,,,,,,,,
Sallemi,2018,"Sallemi, S. and Rjeibi, M. R. and Rouatbi, M. and Amairia, S. and Ben Said, M. and Khbou, M. K. and Gharbi, M.",,,,,,,,,
Salom√≥n,Na,"Salom√≥n, O. D. and Estani, S. S. and Canini, L. and Lanus, E. C.",,,,,,,,,
Salvatore,2014,"Salvatore, D. and Aureli, S. and Baldelli, R. and Di Francesco, A. and Tampieri, M. P. and Galuppi, R.",,,,,,,,,
Salzer,2016,"Salzer, J. S. and Pinto, C. M. and Grippi, D. C. and Williams-Newkirk, A. J. and Peterhans, J. K. and Rwego, I. B. and Carroll, D. S. and Gillespie, T. R.",,,,,,,,,
Sanchez,1996,"Sanchez, C. A. and Sanchez, J. M. and Bernal, I. D. V. and Marin, M. C. S. and Louassini, M. and Maldonado, J. A. and Marquez, F. M.",,,,,,,,,
Santaella,2011,"Santaella, J. and Ocampo, C. B. and Saravia, N. G. and Mendez, F. and Gongora, R. and Gomez, M. A. and Munstermann, L. E. and Quinnell, R. J.",,,,,,,,,
Santi,2014,"Santi, A. and Renzi, M. and Baldelli, R. and Calzolari, M. and Caminiti, A. and Dell'Anna, S. and Galletti, G. and Lombardini, A. and Paternoster, G. and Tamba, M.",,,,,,,,,
Santos,2017,"Santos, H. D. and Galvao, S. R. and Dias, F. E. F. and Ribeiro, T. M. P. and Negreiros, O. and Sousa, S. A. P. and Minharro, S.",,,,,,,,,
Santos,2013,"Santos, M. F. C. and Ribolla, P. E. M. and Alonso, D. P. and Andrade, J. D. and Casaril, A. E. and Ferreira, A. M. T. and Fern and es, C. E. S. and Brazil, R. P. and Oliveira, A. G.",,,,,,,,,
Saraiva,2017,"Saraiva, L. and Leite, C. G. and Lima, Acvmd and de Carvalho, L. O. A. and Pereira, A. A. S. and Rugani, J. M. N. and Rego, F. D. and Gontijo, C. M. F. and Andrade, J. D.",,,,,,,,,
Sarquis,2004,"Sarquis, O. and Borges-Pereira, J. and Mac Cord, J. R. and Gomes, T. F. and Cabello, P. H. and Lima, M. M.",,,,,,,,,
Sarquis,2012,"Sarquis, O. and Carvalho-Costa, F. A. and Toma, H. K. and Georg, I. and Burgoa, M. R. and Lima, M. M.",,,,,,,,,
Sartor,2013,"Sartor, P. A. and Ceballos, L. A. and Orozco, M. M. and Cardinal, M. V. and Gurtler, R. E. and Leguizamon, M. S.",,,,,,,,,
Sastre,2008,"Sastre, N. and Francino, O. and Ramirez, O. and Ensenat, C. and Sanchez, A. and Altet, L.",,,,,,,,,
Sato,2008,"Sato, H. and Leo, N. and Katakai, Y. and Takano, J. and Akari, H. and Nakamura, S. and Une, Y.",,,,,,,,,
Sauda,2018,"Sauda, F. and Mal and rucco, L. and Macri, G. and Scarpulla, M. and De Liberato, C. and Terracciano, G. and Fichi, G. and Berrilli, F. and Perrucci, S.",,,,,,,,,
Savage,2009,"Savage, A. F. and Robert, V. and Goodman, S. M. and Raharimanga, V. and Raherilalao, M. J. and Andrianarimisa, A. and Ariey, F. and Greiner, E. C.",,,,,,,,,
Savani,1999,"Savani, E. S. M. and Galati, E. A. B. and Camargo, Mcgo and D'Auria, S. R. N. and Damaceno, J. T. and Balduino, S. A.",,,,,,,,,
Sazm and ,2016,"Sazm and , A. and Eigner, B. and Mirzaei, M. and Hekmatimoghaddam, S. H. and Harl, J. and Duscher, G. G. and Fuehrer, H. P. and Joachim, A.",,,,,,,,,
Scheuerlein,2004,"Scheuerlein, A. and Ricklefs, R. E.",,,,,,,,,
Schmid-Hempel,2004,"Schmid-Hempel, P. and Funk, C. R.",,,,,,,,,
Schoener,2018,"Schoener, E. and Uebleis, S. S. and Cuk, C. and Nawratil, M. and Obwaller, A. G. and Zechmeister, T. and Lebl, K. and R√°drov√°, J. and Zittra, C. and Vot√Ωpka, J. and Fuehrer, H. P.",,,,,,,,,
Schultz,2010,"Schultz, A. and Underhill, L. G. and Earle, R. A. and Underhill, G.",,,,,,,,,
Sebaio,2012,"Sebaio, F. and Braga, E. M. and Branquinho, F. and Fecchio, A. and Marini, M. A.",,,,,,,,,
Sebaio,2010,"Sebaio, F. and Braga, E. M. and Branquinho, F. and Manica, L. T. and Marini, M. A.",,,,,,,,,
Seck,2010,"Seck, M. T. and Bouyer, J. and Sall, B. and Bengaly, Z. and Vreysen, M. J. B.",,,,,,,,,
Sehgal,2001,"Sehgal, R. N. M. and Jones, H. I. and Smith, T. B.",,,,,,,,,
Sehgal,2005,"Sehgal, R. N. M. and Jones, H. I. and Smith, T. B.",,,,,,,,,
Selby,2013,"Selby, R. and Bardosh, K. and Picozzi, K. and Waiswa, C. and Welburn, S. C.",,,,,,,,,
Selmi,2019,"Selmi, R. and Dhibi, M. and Ben Said, M. and Ben Yahia, H. and Abdelaali, H. and Ameur, H. and Baccouche, S. and Gritli, A. and Mhadhbi, M.",,,,,,,,,
Semiaosantos,1995,"Semiaosantos, S. J. and Elharith, A. and Ferreira, E. and Pires, C. A. and Sousa, C. and Gusmao, R.",,,,,,,,,
Sengupta,2016,"Sengupta, P. P. and Ligi, M. and Rudramurthy, G. R. and Balamurugan, V. and Rahman, H.",,,,,,,,,
Shadomy,2004,"Shadomy, S. V. and Waring, S. C. and Chappell, C. L.",,,,,,,,,
Shafiyyah,2012,"Shafiyyah, C. O. S. and Jamaiah, I. and Rohela, M. and Lau, Y. L. and Aminah, F. S.",,,,,,,,,
Shahzad,2010,"Shahzad, W. and Munir, R. and Khan, M. S. and Ahmad, M. D. and Ijaz, M. and Ahmad, A. and Iqbal, M.",,,,,,,,,
Shang,2011,"Shang, L. M. and Peng, W. P. and Jin, H. T. and Xu, D. and Zhong, N. N. and Wang, W. L. and Wu, Y. X. and Liu, Q.",,,,,,,,,
Sharbatkhori,2014,"Sharbatkhori, M. and Spotin, A. and Taherkhani, H. and Roshanghalb, M. and Parvizi, P.",,,,,,,,,
Sharma,2015,"Sharma, A. and Das Singla, L. and Tuli, A. and Kaur, P. and Bal, M. S.",,,,,,,,,
Sharma,2013,"Sharma, A. and Das Singla, L. and Tuli, A. and Kaur, P. and Batth, B. K. and Javed, M. and Juyal, P. D.",,,,,,,,,
Sharma,2011,"Sharma, A. and Sharma, B. and Kumar, A. and Tiwari, M. and Ramsagar",,,,,,,,,
Sharma,2012,"Sharma, P. and Juyal, P. D. and Singla, L. D. and Chachra, D. and Pawar, H.",,,,,,,,,
Sheferaw,2016,"Sheferaw, D. and Birhanu, B. and Asrade, B. and Abera, M. and Tusse, T. and Fikadu, A. and Denbarga, Y. and Gona, Z. and Regassa, A. and Moje, N. and Kussito, E. and Mekibib, B. and Asefa, T. and Woldesenbet, Z.",,,,,,,,,
Shender,2014,"Shender, L. A. and De Los Santos, M. and Montgomery, J. M. and Conrad, P. A. and Ghersi, B. M. and Razuri, H. and Lescano, A. G. and Mazet, J. A. K.",,,,,,,,,
Shereni,2016,"Shereni, W. and Anderson, N. E. and Nyakupinda, L. and Cecchi, G.",,,,,,,,,
Sherry,2011,"Sherry, K. and Miro, G. and Trotta, M. and Mir and a, C. and Montoya, A. and Espinosa, C. and Ribas, F. and Furlanello, T. and Solano-Gallego, L.",,,,,,,,,
Sigauque,2000,"Sigauque, I. and Van den Bossche, P. and Moiana, M. and Jamal, S. and Neves, L.",,,,,,,,,
Silaghi,2014,"Silaghi, C. and Knaus, M. and Rapti, D. and Kusi, I. and Shukullari, E. and Hamel, D. and Pfister, K. and Rehbein, S.",,,,,,,,,
Silbermayr,2013,"Silbermayr, K. and Li, F. Y. and Soudre, A. and Muller, S. and Solkner, J.",,,,,,,,,
Silva,2017,"Silva, J. D. and Melo, D. H. M. and Costa, J. A. G. and Costa, D. F. and Silva, R. B. S. and Melo, M. A. and Azevedo, S. S. and Alves, C. J.",,,,,,,,,
Silva,2016,"Silva, R. B. S. and Mendes, R. S. and Santana, V. L. and Souza, H. C. and Ramos, C. P. S. and Souza, A. P. and Andrade, P. P. and Melo, M. A.",,,,,,,,,
Silva,2018,"Silva, R. B. S. and Porto, M. L. and Barbosa, W. D. and de Souza, H. C. and Marques, Nfdp and Azevedo, S. S. and de Andrade, P. P. and de Melo, M. A.",,,,,,,,,
Silva,2014,"Silva, R. D. N. and Ramos, R. A. N. and Pimentel, D. D. and Oliveira, G. M. D. and de Carvalho, G. A. and Santana, M. D. and Faustino, M. A. D. and Alves, L. C.",,,,,,,,,
Silva-S√°nchez,2016,"Silva-S√°nchez, C. J. and Ar√©valo, C. and Viloria, N. and Palmera, J. R.",,,,,,,,,
Silveira,2012,"Silveira, F. T. and Carneiro, L. A. and Ramos, P. K. S. and Chagas, E. J. and Lima, L. V. R. and Campos, M. B. and Laurenti, M. D. and Gomes, C. M. C. and Corbett, C. E. P.",,,,,,,,,
Simo,2014,"Simo, G. and Fogue, P. S. and Melachio, T. T. T. and Njiokou, F. and Kuiate, J. R. and Asonganyi, T.",,,,,,,,,
Simo,2014,"Simo, G. and Njitchouang, G. R. and Melachio, T. T. T. and Njiokou, F. and Cuny, G. and Tazoacha, A.",,,,,,,,,
Simo,2012,"Simo, G. and Silatsa, B. and Flobert, N. and Lutumba, P. and Mansinsa, P. and Madinga, J. and Manzambi, E. and De Deken, R. and Asonganyi, T.",,,,,,,,,
Simo,2013,"Simo, G. and Sobgwi, P. F. and Njitchouang, G. R. and Njiokou, F. and Kuiate, J. R. and Cuny, G. and Asonganyi, T.",,,,,,,,,
Simukoko,2007,"Simukoko, H. and Marcotty, T. and Phiri, I. and Geysen, D. and Vercruysse, J. and Van den Bossche, P.",,,,,,,,,
Simwango,2017,"Simwango, M. and Ngonyoka, A. and Nnko, H. J. and Salekwa, L. P. and Ole-Neselle, M. and Kimera, S. I. and Gwakisa, P. S.",,,,,,,,,
Singh,2017,"Singh, A. P. and Tripathi, A. K. and Singh, R. K.",,,,,,,,,
Singh,2004,"Singh, N. and Pathak, K. M. L. and Kumar, R.",,,,,,,,,
Sinpoo,2019,"Sinpoo, C. and Disayathanoowat, T. and Williams, P. H. and Chantawannakul, P.",,,,,,,,,
Sinshaw,2006,"Sinshaw, A. and Abebe, G. and Desquesnes, M. and Yoni, W.",,,,,,,,,
Snak,2018,"Snak, A. and Lara, A. A. and Garcia, F. G. and Pieri, E. M. and da Silveira, J. A. G. and Osaki, S. C.",,,,,,,,,
Sobia,2018,"Sobia, M. and Mirza, I. S. and Nuzhat, S. and Sonia, T. and Abul, H. and Hafiz, M. A. and Muhammad, D. and Muhammad, F. Q.",,,,,,,,,
Sobrino,2008,"Sobrino, R. and Ferroglio, E. and Oleaga, A. and Romano, A. and Millan, J. and Revilla, A. and Arnal, M. C. and Trisciuoglio, A. and Gortazar, C.",,,,,,,,,
Solano,1999,"Solano, P. and Michel, J. F. and LeFrancois, T. and de La Rocque, S. and Sidibe, I. and Zoungrana, A. and Cuisance, D.",,,,,,,,,
Solano-Gallego,2006,"Solano-Gallego, L. and Llull, J. and Osso, M. and Hegarty, B. and Breitschwerdt, E.",,,,,,,,,
Solano-Gallego,2001,"Solano-Gallego, L. and Morell, P. and Arboix, M. and Alberola, J. and Ferrer, L.",,,,,,,,,
Solano-Gallego,2012,"Solano-Gallego, L. and Rossi, L. and Scroccaro, A. M. and Montarsi, F. and Caldin, M. and Furlanello, T. and Trotta, M.",,,,,,,,,
Solca,2014,"Solca, M. D. and Bastos, L. A. and Guedes, C. E. S. and Bordoni, M. and Borja, L. S. and Larangeira, D. F. and Tuy, Pgde and Amorim, Ldaf and Nascimento, E. G. and Oliveira, G. G. D. and dos-Santos, W. L. C. and Fraga, D. B. M. and Veras, P. S. T.",,,,,,,,,
Soltani,2019,"Soltani, S. and Foroutan, M. and Hezarian, M. and Afshari, H. and Kahvaz, M. S.",,,,,,,,,
Sosa-Gomez,2005,"Sosa-Gomez, D. R. and Borges, E. and Viera, Ihtl and Costa, F. and Oliveira, C. N.",,,,,,,,,
Sousa,2011,"Sousa, S. and Lopes, A. P. and Cardoso, L. and Silvestre, R. and Schallig, H. and Reed, S. G. and da Silva, A. C.",,,,,,,,,
Sousa,2019,"Sousa, V. R. F. and Dias, Afdr and Rodrigues, J. Y. and Torres, M. D. and Moreira, Jmar and Nakazato, L. and Dutra, V. and de Almeida, Adpf",,,,,,,,,
Souza,2008,"Souza, A. I.",,,,,,,,,
Souza,2009,"Souza, A. I. and Oliveira, Tmfs and Machado, R. Z. and Camacho, A. A.",,,,,,,,,
Sow,2013,"Sow, A. and Ganaba, R. and Percoma, L. and Sidibe, I. and Bengaly, Z. and Adam, Y. and Kone, P. and Sawadogo, G. J. and Van den Abbeele, J. and Marcotty, T. and Delespaux, V.",,,,,,,,,
Sow,2012,"Sow, A. and Sidibe, I. and Bengaly, Z. and Marcotty, T. and Sere, M. and Diallo, A. and Vitouley, H. S. and Nebie, R. L. and Ouedraogo, M. and Akoda, G. K. and Van den Bossche, P. and Van Den Abbeele, J. and De Deken, R. and Delespaux, V.",,,,,,,,,
Spada,2016,"Spada, E. and Canzi, I. and Baggiani, L. and Perego, R. and Vitale, F. and Migliazzo, A. and Proverbio, D.",,,,,,,,,
Specht,2008,"Specht, E. J. K.",,,,,,,,,
Spodareva,Na,"Spodareva, V. V. and Grybchuk-Ieremenko, A. and Losev, A. and Votypka, J. and Lukes, J. and Yurchenko, V. and Kostygov, A. Y.",,,,,,,,,
Stevanovic,2016,"Stevanovic, J. and Schwarz, R. S. and Vejnovic, B. and Evans, J. D. and Irwin, R. E. and Glavinic, U. and Stanimirovic, Z.",,,,,,,,,
Suh,2017,"Suh, P. F. and Njiokou, F. and Mamoudou, A. and Ahmadou, T. M. and Mouhaman, A. and Garabed, R.",,,,,,,,,
Sumbria,2017,"Sumbria, D. and Singla, L. D. and Kumar, R. and Bal, M. S. and Kaur, P.",,,,,,,,,
Sumbria,2014,"Sumbria, D. and Singla, L. D. and Sharma, A. and Moudgil, A. D. and Bal, M. S.",,,,,,,,,
Sun,2012,"Sun, K. and Guan, W. and Zhang, J. G. and Wang, Y. J. and Tian, Y. and Liao, L. and Yang, B. B. and Chen, D. L. and Chen, J. P.",,,,,,,,,
Svobodova,2015,"Svobodova, M. and Volf, P. and Votypka, J.",,,,,,,,,
Svobodova,2015,"Svobodova, M. and Weidinger, K. and Peske, L. and Volf, P. and Votypka, J. and Vorisek, P.",,,,,,,,,
Szpeiter,Na,"Szpeiter, B. B. and Ferreira, J. I. G. and Assis, F. F. V. and Stelmachtchuk, F. N. and Peixoto Junior, K. C. and Ajzenberg, D. and Minervino, A. H. H. and Gennari, S. M. and Marcili, A.",,,,,,,,,
Tabar,2008,"Tabar, M. D. and Altet, L. and Francino, O. and Sanchez, A. and Ferrer, L. and Roura, X.",,,,,,,,,
Tabar,2009,"Tabar, M. D. and Francino, O. and Altet, L. and Sanchez, A. and Ferrer, L. and Roura, X.",,,,,,,,,
Tabar,2008,"Tabar, M. D. and Roura, X. and Francino, O. and Altet, L. and de Gopegui, R. R.",,,,,,,,,
Tadesse,2010,"Tadesse, A. and Tsegaye, B.",,,,,,,,,
Tafese,2012,"Tafese, W. and Melaku, A. and Fentahun, T.",,,,,,,,,
Tagueu,2018,"Tagueu, S. K. and Farikou, O. and Njiokou, F. and Simo, G.",,,,,,,,,
Takeet,2013,"Takeet, M. I. and Fagbemi, B. O. and De Donato, M. and Yakubu, A. and Rodulfo, H. E. and Peters, S. O. and Wheto, M. and Imumorin, I. G.",,,,,,,,,
Tamay-Segovia,2017,"Tamay-Segovia, P. and Blum-Dominguez, S. C. and Nunez-Oreza, L. A. and Martinez-Hern and ez, F. and Gomez-Solano, M. I. and Maldonado-Velazquez, M. G. and Retana-Guiascon, O. G.",,,,,,,,,
Tanczos,2012,"Tanczos, B. and Balogh, N. and Kiraly, L. and Biksi, I. and Szeredi, L. and Gyurkovsky, M. and Scalone, A. and Fiorentino, E. and Gramiccia, M. and Farkas, R.",,,,,,,,,
Tarello,2005,"Tarello, W.",,,,,,,,,
Tasew,2012,"Tasew, S. and Duguma, R.",,,,,,,,,
Tatard,2017,"Tatard, C. and Garba, M. and Gauthier, P. and Hima, K. and Artige, E. and Dossou, Dkhj and Gagare, S. and Genson, G. and Truc, P. and Dobigny, G.",,,,,,,,,
Tchamdja,2017,"Tchamdja, E. and Kulo, A. E. and Vitouley, H. S. and Batawui, K. and Bankole, A. A. and Adomefa, K. and Cecchi, G. and Hoppenheit, A. and Clausen, P. H. and De Deken, R. and Van Den Abbeele, J. and Marcotty, T. and Delespaux, V.",,,,,,,,,
Tehseen,2017,"Tehseen, S. and Jahan, N. and Desquesnes, M. and Shahzad, M. I. and Qamar, M. F.",,,,,,,,,
Tehseen,2015,"Tehseen, S. and Jahan, N. and Qamar, M. F. and Desquesnes, M. and Shahzad, M. I. and Deborggraeve, S. and Buscher, P.",,,,,,,,,
Teixeira,2001,"Teixeira, A. R. L. and Monteiro, P. S. and Rebelo, J. M. and Arganaraz, E. R. and Vieira, D. and Lauria-Pires, L. and Nascimento, R. and Vexenat, C. A. and Silva, A. R. and Ault, S. K. and Costa, J. M.",,,,,,,,,
Teixeira,2016,"Teixeira, M. C. and Stobbe, N. S. and Schmidt, V. and de Lima, V. M. F. and Tartarotti, A. L. and Ramos, R. R. and de Araujo, F. A. P.",,,,,,,,,
Teles,Na,"Teles, C. B. G. and dos Santos, A. P. D. and Freitas, R. A. and de Oliveira, A. F. J. and Ogawa, G. M. and Rodrigues, M. S. and Pessoa, F. A. C. and Medeiros, J. F. and Camargo, L. M. A.",,,,,,,,,
Telford,1991,"Telford, S. R. and Forrester, D. J.",,,,,,,,,
Terefe,2015,"Terefe, E. and Haile, A. and Mulatu, W. and Dessie, T. and Mwai, O.",,,,,,,,,
Thies,2013,"Thies, S. F. and Ribeiro, A. L. M. and Michalsky, E. M. and Miyazaki, R. D. and Fortes-Dias, C. L. and Fontes, C. J. F. and Dias, E. S.",,,,,,,,,
Thomaz-Soccol,2009,"Thomaz-Soccol, V. and Castro, E. A. and Navarro, I. T. and de Farias, M. R. and de Souza, L. M. and Carvalho, Y. and Bispo, S. and Membrive, N. A. and Minozzo, J. C. and Truppel, J. and Bueno, W. and Luz, E.",,,,,,,,,
Tiwary,2012,"Tiwary, P. and Kumar, D. and Singh, R. P. and Rai, M. and Sundar, S.",,,,,,,,,
Toepp,2017,"Toepp, A. J. and Schaut, R. G. and Scott, B. D. and Mathur, D. and Berens, A. J. and Petersen, C. A.",,,,,,,,,
Tognazzo,2012,"Tognazzo, M. and Schmid-Hempel, R. and Schmid-Hempel, P.",,,,,,,,,
Tomas-Perez,2014,"Tomas-Perez, M. and Khaldi, M. and Riera, C. and Mozo-Leon, D. and Ribas, A. and Hide, M. and Barech, G. and Benyettou, M. and Seghiri, K. and Doudou, S. and Fisa, R.",,,,,,,,,
Tome,2011,"Tome, R. O. and Gaio, F. C. and Generoso, D. and Menozzi, B. D. and Langoni, H.",,,,,,,,,
Tonelli,2017,"Tonelli, G. B. and Tanure, A. and Rego, F. D. and Carvalho, G. M. D. and Stumpp, R. and Assimos, G. R. and Campos, A. M. and Lima, Acvmd and Gontijo, C. M. F. and Paz, G. F. and Andrade, J. D.",,,,,,,,,
Tonelli,Na,"Tonelli, G. B. and Tanure, A. and R√™go, F. D. and De Lima Carvalho, G. M. and Sim√µes, T. C. and Filho, J. D. A.",,,,,,,,,
Tono,2015,"Tono, R. R. and Faleke, O. O. and Magaji, A. A. and Alay and e, M. O. and Fajinmi, A. O. and Ibitoye, E. B.",,,,,,,,,
Tortora,2000,"Tortora, C. and Bejarano, I. and Dipierri, J. and Alfaro, E. and Garcia, T.",,,,,,,,,
T√∂z,2013,"T√∂z, S. O. and Ertabaklar, H. and G√∂√ßmen, B. and Demir, S. and Karaku≈ü, M. and Arserim, S. K. and Balcio«ßlu, I. C. and Canak√ßi, T. and Ozbel, Y.",,,,,,,,,
Toz,2009,"Toz, S. O. and Sakru, N. and Ertabaklar, H. and Demir, S. and Sengul, M. and Ozbel, Y.",,,,,,,,,
Trindade,2015,"Trindade, C. N. D. and da Cunha, N. A. and de Avila, L. F. D. and Villela, M. M. and Farias, N. A. D. and Leite, F. P. L.",,,,,,,,,
Tripodi,2014,"Tripodi, A. D. and Cibils-Stewart, X. and McCornack, B. P. and Szalanski, A. L.",,,,,,,,,
Tripodi,2018,"Tripodi, A. D. and Szalanski, A. L. and Strange, J. P.",,,,,,,,,
Trueb,2018,"Trueb, I. and Portela, R. D. and Franke, C. R. and Carneiro, I. O. and Ribeiro, G. J. and Soares, R. P. and Barrouin-Melo, S. M.",,,,,,,,,
Tsakmakidis,2017,"Tsakmakidis, I. and Angelopoulou, K. and Dovas, C. I. and Dokianakis, E. and Tamvakis, A. and Symeonidou, I. and Antoniou, M. and Diakou, A.",,,,,,,,,
Tuiran,2016,"Tuiran, L. E. P. and Diaz-Olmos, Y. A. and Paternina-Gomez, M. and Carrillo-Bonilla, L. M. and Velez, I. D. and Bejarano, E. E.",,,,,,,,,
T√Ωƒç,2013,"T√Ωƒç, J. and Vot√Ωpka, J. and Klepetkov√°, H. and ≈†ul√°kov√°, H. and Jirk≈Ø, M. and Luke≈°, J.",,,,,,,,,
Ul Hasan,2006,"Ul Hasan, M. and Muhammad, G. and Gutierrez, C. and Iqbal, Z. and Shakoor, A. and Jabbar, A. and Blouin, E. F. and Maillard, J. C.",,,,,,,,,
Umeakuana,2019,"Umeakuana, P. U. and Gibson, W. and Ezeokonkwo, R. C. and Anene, B. M.",,,,,,,,,
Umezawa,2009,"Umezawa, E. S. and Souza, A. I. and Pinedo-Cancino, V. and Marcondes, M. and Marcili, A. and Camargo, L. M. A. and Camacho, A. A. and Stolf, A. M. S. and Teixeira, M. M. G.",,,,,,,,,
Utuk,2018,"Utuk, A. E. and Gokmen, T. G. and Bolacali, M. and Balkaya, I. and Simsek, S.",,,,,,,,,
Valadas,2010,"Valadas, S. and Minervino, A. H. H. and Lima, V. M. F. and Soares, R. M. and Ortolani, E. L. and Gennari, S. M.",,,,,,,,,
Valdivia,2012,"Valdivia, H. O. and De Los Santos, M. B. and Fern and ez, R. and Baldeviano, G. C. and Zorrilla, V. O. and Vera, H. and Lucas, C. M. and Edgel, K. A. and Lescano, A. G. and Mundal, K. D. and Graf, P. C. F.",,,,,,,,,
Valera,2017,"Valera, K. R. and Vel√°squez, L. D. and Silva-S√°nchez, C. J. and Arevalo, C. O. and Romero-Palmera, J.",,,,,,,,,
Valkiunas,2001,"Valkiunas, G. and Iezhova, T. A.",,,,,,,,,
Valkiunas,2004,"Valkiunas, G. and Iezhova, T. A. and Brooks, D. R. and Hanelt, B. and Brant, S. V. and Sutherlin, M. E. and Causey, D.",,,,,,,,,
Valkiunas,2011,"Valkiunas, G. and Iezhova, T. A. and Carlson, J. S. and Sehgal, R. N. M.",,,,,,,,,
Valkiunas,2001,"Valkiunas, G. and Iezhova, T. A. and Mironov, S. V.",,,,,,,,,
Valkiunas,2003,"Valkiunas, G. and Iezhova, T. A. and Shapoval, A. P.",,,,,,,,,
Valkiunas,2005,"Valkiunas, G. and Sehgal, R. N. M. and Iezhova, T. A. and Smith, T. B.",,,,,,,,,
V and erplanck,Na,"V and erplanck, M. and Roger, N. and Moerman, R. and Ghisbain, G. and G√©rard, M. and Popowski, D. and Granica, S. and Fournier, D. and Meeus, I. and Piot, N. and Smagghe, G. and Terrana, L. and Michez, D.",,,,,,,,,
Vargas,2017,"Vargas, M. and Arismendi, N. and Riveros, G. and Zapata, N. and Bruna, A. and Vidal, M. and Rodriguez, M. and Gerding, M.",,,,,,,,,
Vasquez,2013,"Vasquez, C. and Robledo, S. and Calle, J. and Triana, O.",,,,,,,,,
Velo,2017,"Velo, E. and Bongiorno, G. and Kadriaj, P. and Myrseli, T. and Crilly, J. and Lika, A. and Mersini, K. and Di Muccio, T. and Bino, S. and Gramiccia, M. and Gradoni, L. and Maroli, M.",,,,,,,,,
Vidal-Acosta,2000,"Vidal-Acosta, V. and Ibanez-Bernal, S. and Martinez-Campos, C.",,,,,,,,,
Villagran,2008,"Villagran, M. E. and Marin, C. and Hurtado, A. and Sanchez-Moreno, M. and de Diego, J. A.",,,,,,,,,
Villagran,2011,"Villagran, M. E. and Martinez-Ibarra, J. A. and de Diego, J. A.",,,,,,,,,
Villareal,2013,"Villareal, M. V. and Mingala, C. N. and Rivera, W. L.",,,,,,,,,
Villena,2018,"Villena, F. E. and Gomez-Puerta, L. A. and Jhonston, E. J. and Del Alcazar, O. M. and Maguina, J. L. and Albujar, C. and Laguna-Torres, V. A. and Recuenco, S. E. and Ballard, S. B. and Ampuero, J. S.",,,,,,,,,
von Dohlen,2018,"von Dohlen, A. R. and Cheathem, N. and Tiwari, K. and Sharma, R. N.",,,,,,,,,
Votypka,2012,"Votypka, J. and Klepetkova, H. and Jirku, M. and Kment, P. and Lukes, J.",,,,,,,,,
Votypka,2012,"Votypka, J. and Klepetkova, H. and Yurchenko, V. Y. and Horak, A. and Lukes, J. and Maslov, D. A.",,,,,,,,,
Vot√Ωpka,2019,"Vot√Ωpka, J. and Kment, P. and Kriegov√°, E. and Vermeij, M. J. A. and Keeling, P. J. and Yurchenko, V. and Luke≈°, J.",,,,,,,,,
Votypka,2010,"Votypka, J. and Maslov, D. A. and Yurchenko, V. and Jirku, M. and Kment, P. and Lun, Z. R. and Lukes, J.",,,,,,,,,
Votypka,2018,"Votypka, J. and Pafco, B. and Modry, D. and Mbohli, D. and Tagg, N. and Petrzelkova, K. J.",,,,,,,,,
Vot√Ωpka,2013,"Vot√Ωpka, J. and Sukov√°, E. and Kraeva, N. and Ishemgulova, A. and Du≈æ√≠, I. and Luke≈°, J. and Yurchenko, V.",,,,,,,,,
Voyvoda,2004,"Voyvoda, H. and Pasa, S. and Toz, S. O. and Ozbel, Y. and Ertabaklar, H.",,,,,,,,,
Waiswa,2003,"Waiswa, C. and Olaho-Mukani, W. and Katunguka-Rwakishaya, E.",,,,,,,,,
Wang,2011,"Wang, J. Y. and Ha, Y. and Gao, C. H. and Wang, Y. and Yang, Y. T. and Chen, H. T.",,,,,,,,,
Weber,2019,"Weber, J. S. and Ngomtcho, S. C. H. and Shaida, S. S. and Chechet, G. D. and Gbem, T. T. and Nok, J. A. and Mamman, M. and Achukwi, D. M. and Kelm, S.",,,,,,,,,
Wei,Na,"Wei, F. and Shang, L. M. and Jin, H. T. and Lian, H. and Liu, W. S. and Li, Z. Y. and Gao, H. W. and Liu, Q.",,,,,,,,,
Weny,2017,"Weny, G. and Okwee-Acai, J. and Okech, S. G. and Tumwine, G. and Ndyanabo, S. and Abigaba, S. and Goldberg, T. L.",,,,,,,,,
Whitehorn,2011,"Whitehorn, P. R. and Tinsley, M. C. and Brown, M. J. F. and Darvill, B. and Goulson, D.",,,,,,,,,
Whitehorn,2013,"Whitehorn, P. R. and Tinsley, M. C. and Brown, M. J. F. and Goulson, D.",,,,,,,,,
Wilfert,2011,"Wilfert, L. and Longdon, B. and Ferreira, A. G. A. and Bayer, F. and Jiggins, F. M.",,,,,,,,,
Willi,2015,"Willi, B. and Spiri, A. M. and Meli, M. L. and Grimm, F. and Beatrice, L. and Riond, B. and Bley, T. and Jordi, R. and Dennler, M. and Hofmann-Lehmann, R.",,,,,,,,,
Williams,2019,"Williams, M. K. F. and Tripodi, A. D. and Szalanski, A. L.",,,,,,,,,
Wong,2016,"Wong, Y. Y. and Macias, K. J. S. and Martinez, D. G. and Solorzano, L. F. and Ramirez-Sierra, M. J. and Herrera, C. and Dumonteil, E.",,,,,,,,,
Xu,2015,"Xu, D. and Zhang, J. L. and Shi, Z. S. and Song, C. L. and Zheng, X. F. and Zhang, Y. and Hao, Y. Q. and Dong, H. J. and Wei, L. J. and El-Mahallawy, H. S. and Kelly, P. and Xiong, W. B. and Wang, H. and Li, J. J. and Zhang, X. J. and Gu, J. H. and Wang, C. M.", X. J. and Gu, J. H. and Wang, C. M.,,,,,,
Xu,2018,"Xu, G. and Palmer-Young, E. and Skyrm, K. and Daly, T. and Sylvia, M. and Averill, A. and Rich, S.",,,,,,,,,
Yabsley,2002,"Yabsley, M. J. and Noblet, G. P.",,,,,,,,,
Yabsley,2001,"Yabsley, M. J. and Noblet, G. P. and Pung, O. J.",,,,,,,,,
Yadav,2019,"Yadav, S. C. and Kumar, P. and Khurana, S. and Kumar, R.",,,,,,,,,
YaghoobiErshadi,1996,"YaghoobiErshadi, M. R. and Javadian, E.",,,,,,,,,
Yefi-Quinteros,2018,"Yefi-Quinteros, E. and Munoz-San Martin, C. and Bacigalupo, A. and Correa, J. P. and Cattan, P. E.",,,,,,,,,
Yurchenko,Na,"Yurchenko, V. and Kostygov, A. and Havlov√°, J. and Grybchuk-Ieremenko, A. and ≈†evƒç√≠kov√°, T. and Luke≈°, J. and ≈†evƒç√≠k, J. and Vot√Ωpka, J.",,,,,,,,,
Yusufmia,2010,"Yusufmia, Sbas and Collins, N. E. and Nkuna, R. and Troskie, M. and Van den Bossche, P. and Penzhorn, B. L.",,,,,,,,,
Zaidi,2017,"Zaidi, F. and Fatima, S. H. and Jan, T. and Fatima, M. and Ali, A. and Khisroon, M. and Adnan, M. and Rasheed, S. B.",,,,,,,,,
Zanet,2014,"Zanet, S. and Sposimo, P. and Trisciuoglio, A. and Giannini, F. and Strumia, F. and Ferroglio, E.",,,,,,,,,
Zangooie,2018,"Zangooie, F. and Ganjali, M. and Keighobadi, M. and Nabavi, R.",,,,,,,,,
