First,Year,Authors,,,,,,,,,
Abbaszadeh Afshar,2018,"Abbaszadeh Afshar, M. J. and Sharifi, I. and Bamorovat, M. and Mohebali, M. and Bahreini, M. S. and Naderi, A.",,,,,,,,,
Abdeen,2002,"Abdeen, Z. A. and Sawalha, S. S. and Eisenberger, C. L. and Khanfar, H. N. and Greenblatt, C. L. and Yousef, O. and Schnur, L. F. and Azmi, K. and Warburg, A. and Bader, K. A. and Jaffe, C. L. and Baneth, G.",,,,,,,,,
Abebe,2017,"Abebe, R. and Gute, S. and Simon, I.",,,,,,,,,
Abebe,2010,"Abebe, R. and Wolde, A.",,,,,,,,,
Abrantes,2016,"Abrantes, T. R. and Madeira, M. D. and da Silva, D. A. and Perie, Cdfs and Mendes, A. A. V. and Menezes, R. C. and Silva, V. L. and Figueiredo, F. B.",,,,,,,,,
Abrantes,2018,"Abrantes, T. R. and Werneck, G. L. and de Almeida, A. S. and Figueiredo, F. B.",,,,,,,,,
Acapovi-Yao,2016,"Acapovi-Yao, G. and Cisse, B. and Koumba, C. R. Z. and Mavoungou, J. F.",,,,,,,,,
Acosta,2017,"Acosta, N. and Lopez, E. and Lewis, M. D. and Llewellyn, M. S. and Gomez, A. and Roman, F. and Miles, M. A. and Yeo, M.",,,,,,,,,
Adam,2012,"Adam, Y. and Marcotty, T. and Cecchi, G. and Mahama, C. I. and Solano, P. and Bengaly, Z. and Van den Bossche, P.",,,,,,,,,
Adams,2008,"Adams, E. R. and Hamilton, P. B. and Malele, II and Gibson, W. C.",,,,,,,,,
Adel,2015,"Adel, A. and Abatih, E. and Speybroeck, N. and Soukehal, A. and Bouguedour, R. and Boughalem, K. and Bouhbal, A. and Djerbal, M. and Saegerman, C. and Berkvens, D.",,,,,,,,,
Adel,2010,"Adel, A. and Saegerman, C. and Speybroeck, N. and Praet, N. and Victor, B. and De Deken, R. and Soukehal, A. and Berkvens, D.",,,,,,,,,
Aharonson-Raz,2015,"Aharonson-Raz, K. and Baneth, G. and Lopes, A. P. and Brancal, H. and Schallig, H. and Cardoso, L. and Steinman, A.",,,,,,,,,
Aisien,2015,"Aisien, M. S. O. and Aigbirior, P. O. and Ovwah, E. and Edo-Taiwo, O.",,,,,,,,,
Ajaoud,2015,"Ajaoud, M. and Es-Sette, N. and Charrel, R. N. and Laamrani-Idrissi, A. and Nhammi, H. and Riyad, M. and Lemrani, M.",,,,,,,,,
Akhavan,2010,"Akhavan, A. A. and Yaghoobi-Ershadi, M. R. and Mirhendi, H. and Alimohammadian, M. H. and Rassi, Y. and Shareghi, N. and Jafari, R. and Ar and ian, M. H. and Abdoli, H. and Ghanei, M. and Jalali-Z and , N. and Khamesipour, A.",,,,,,,,,
Akhoundi,2013,"Akhoundi, M. and Baghaei, A. and Depaquit, J. and Parvizi, P.",,,,,,,,,
Akhoundi,2013,"Akhoundi, M. and Mohebali, M. and Asadi, M. and Mahmodi, M. R. and Amraei, K. and Mirzaei, A.",,,,,,,,,
Akhtardanesh,2017,"Akhtardanesh, B. and Sharifi, I. and Mohammadi, A. and Mostafavi, M. and Hakimmipour, M. and Pourafshar, N. G.",,,,,,,,,
Akinpelu,2008,"Akinpelu, A. I.",,,,,,,,,
Akter,2016,"Akter, S. and Alam, M. Z. and Nakao, R. and Yasin, M. G. and Kato, H. and Katakura, K.",,,,,,,,,
Alanazi,2018,"Alanazi, A. D.",,,,,,,,,
Alanazi,2019,"Alanazi, A. D. and Puschendorf, R. and Alyousif, M. S. and Al-Khalifa, M. S. and Alharbi, S. A. and Al-Shehri, Z. S. and Said, A. E. and Alanazi, I. O. and Al-Mohammed, H. I. and Alraey, Y. A.",,,,,,,,,
Alanazi,2018,"Alanazi, A. D. and Puschendorf, R. and Salim, B. and Alyousif, M. S. and Alanazi, I. O. and Al-shehri, H. R.",,,,,,,,,
Alarabi,2019,"Alarabi, M. E. M. and Mohamed, Y. O. and Elshafie, E. I. and Alharbi, Y. J. A. and Al-Mekhlafi, H. M.",,,,,,,,,
Albuquerque,2017,"Albuquerque, A. and Campino, L. and Cardoso, L. and Cortes, S.",,,,,,,,,
Aleman,2017,"Aleman, A. and Guerra, T. and Maikis, T. J. and Milholl and , M. T. and Castro-Arellano, I. and Forstner, M. R. J. and Hahn, D.",,,,,,,,,
Alho,2016,"Alho, A. M. and Pita, J. and Amaro, A. and Amaro, F. and Schnyder, M. and Grimm, F. and Custodio, A. C. and Cardoso, L. and Deplazes, P. and de Carvalho, L. M.",,,,,,,,,
Alias,2014,"Alias, S. N. and Sahimin, N. and Edah, M. A. and Mohd-Zain, S. N.",,,,,,,,,
Almeida,2016,"Almeida, C. E. and Faucher, L. and Lavina, M. and Costa, J. and Harry, M.",,,,,,,,,
Alroy,2015,"Alroy, K. A. and Huang, C. and Gilman, R. H. and Quispe-Machaca, V. R. and Marks, M. A. and Ancca-Juarez, J. and Hillyard, M. and Verastegui, M. and Sanchez, G. and Cabrera, L. and Vidal, E. and Billig, E. M. W. and Cama, V. A. and Naquira, C. and Bern, C. and Levy, M. Z. and Working Grp Chagas Dis, Peru", C. and Levy, M. Z. and Working Grp Chagas Dis, Peru,,,,,,
Alvasen,2016,"Alvasen, K. and Johansson, S. M. and Hoglund, J. and Ssuna, R. and Emanuelson, U.",,,,,,,,,
Alves,2017,"Alves, W. P. and Cuglovici, D. A. and Furtado, L. F. V. and da Silveira, J. A. G. and Facury, E. J. and Ribeiro, M. F. B. and Rabelo, E. M. L.",,,,,,,,,
Amer,2011,"Amer, S. and Ryu, O. and Tada, C. and Fukuda, Y. and Inoue, N. and Nakai, Y.",,,,,,,,,
Amiri Ghannat Saman,2019,"Amiri Ghannat Saman, I. and Dayer, M. S. and Pirestani, M.",,,,,,,,,
Amusategui,2004,"Amusategui, I. and Sainz, A. and Aguirre, E. and Tesouro, M. A.",,,,,,,,,
Anderson,Na,"Anderson, J. M. and Samake, S. and Jaramillo-Gutierrez, G. and Sissoko, I. and Coulibaly, C. A. and Traor√©, B. and Soucko, C. and Guindo, B. and Diarra, D. and Fay, M. P. and Lawyer, P. G. and Doumbia, S. and Valenzuela, J. G. and Kamhawi, S.",,,,,,,,,
Angwech,2015,"Angwech, H. and Nyeko, J. H. P. and Opiyo, E. A. and Okello-Onen, J. and Opiro, R. and Echodu, R. and Malinga, G. M. and Njahira, M. N. and Skilton, R. A.",,,,,,,,,
Antonio,2011,"Antonio, E. G. and Malacco, M. A. F. and Gontijo, C. M. F. and Moreira, E. F. and Caldas, I. S. and Pena, J. L. and Machado-Coelho, G. L. L.",,,,,,,,,
Aragort,2005,"Aragort, W. and Alvarez, M. F. and Leiro, J. L. and Sanmartin, M. L.",,,,,,,,,
Araujo,2016,"Araujo, A. C. and Costa, A. P. and Silva, I. W. G. and Matos, N. N. V. G. and Dantas, A. C. S. and Ferreira, F. and Marcili, A. and Horta, M. C.",,,,,,,,,
Arce-Fonseca,2017,"Arce-Fonseca, M. and Carrillo-Sanchez, S. C. and Molina-Barrios, R. M. and Martinez-Cruz, M. and Cedillo-Cobian, J. R. and Henao-Diaz, Y. A. and Rodriguez-Morales, O.",,,,,,,,,
Arismendi,2016,"Arismendi, N. and Bruna, A. and Zapata, N. and Vargas, M.",,,,,,,,,
Arjona,2017,"Arjona, J. G. and Zaragoza, V. M. and Zaragoza, V. C. and Herrera, R. G. and Sanchez, M. M. and Santamaria, M. E. and Cruz, B. L.",,,,,,,,,
Arjona-Jimenez,2012,"Arjona-Jimenez, G. and Villegas, N. and Lopez-Cespedes, A. and Marin, C. and Longoni, S. S. and Bolio-Gonzalez, M. E. and Rodriguez-Vivas, R. I. and Sauri-Arceo, C. H. and Sanchez-Moreno, M.",,,,,,,,,
Aslantas,2005,"Aslantas, O. and Ozdemir, V. and Kilic, S. and Babur, C.",,,,,,,,,
Astudillo,2013,"Astudillo, V. G. and Hern√°ndez, S. M. and Kistler, W. M. and Boone, S. L. and Lipp, E. K. and Shrestha, S. and Yabsley, M. J.",,,,,,,,,
Atarhouch,2003,"Atarhouch, T. and Rami, M. and Bendahman, M. N. and Dakkak, A.",,,,,,,,,
Atasoy,Na,"Atasoy, A. and Pasa, S. and Toz, S. O. and Ertabaklar, H.",,,,,,,,,
Athanasiou,2012,"Athanasiou, L. V. and Kontos, V. I. and Saridomichelakis, M. N. and Rallis, T. S. and Diakou, A.",,,,,,,,,
Attipa,2017,"Attipa, C. and Papasouliotis, K. and Solano-Gallego, L. and Baneth, G. and Nachum-Biala, Y. and Sarvani, E. and Knowles, T. G. and Mengi, S. and Morris, D. and Helps, C. and Tasker, S.",,,,,,,,,
Austen,2015,"Austen, J. M. and O'Dea, M. and Jackson, B. and Ryan, U.",,,,,,,,,
Austen,2011,"Austen, J. M. and Ryan, U. M. and Friend, J. A. and Ditcham, W. G. F. and Reid, S. A.",,,,,,,,,
Averis,2009,"Averis, S. and Thompson, R. C. A. and Lymbery, A. J. and Wayne, A. F. and Morris, K. D. and Smith, A.",,,,,,,,,
Ayllon,2008,"Ayllon, T. and Tesouro, M. A. and Amusategui, I. and Villaescusa, A. and Rodriguez-Franco, F. and Sainz, A. and Sparagano, O. A. E. and Maillard, J. C. and Figueroa, J. V.",,,,,,,,,
Azeem,2019,"Azeem, T. and Tipu, M. Y. and Aslam, A. and Ahmed, S. and Abid, S. A. and Iqbal, A. and Akhtar, N. and Saleem, M. and Mushtaq, A. and Umar, S.",,,,,,,,,
Azizi,2010,"Azizi, K. and Rassi, Y. and Moemenbellah-Fard, M. D.",,,,,,,,,
Azpurua,2010,"Azpurua, J. and De La Cruz, D. and Valderama, A. and Windsor, D.",,,,,,,,,
Babuadze,2014,"Babuadze, G. and Alvar, J. and Argaw, D. and de Koning, H. P. and Iosava, M. and Kekelidze, M. and Tsertsvadze, N. and Tsereteli, D. and Chakhunashvili, G. and Mamatsashvili, T. and Beria, N. and Kal and adze, I. and Ejov, M. and Imnadze, P.",,,,,,,,,
Bacigalupo,2010,"Bacigalupo, A. and Torres-Perez, F. and Segovia, V. and Garcia, A. and Correa, J. P. and Moreno, L. and Arroyo, P. and Cattan, P. E.",,,,,,,,,
Bag,2009,"Bag, S. K. and B and yopadhyay, P. K.",,,,,,,,,
Bajer,2001,"Bajer, A. and Pawelczyk, A. and Behnke, J. M. and Gilbert, F. S. and Sinski, E.",,,,,,,,,
Bakirci,2016,"Bakirci, S. and Bilgic, H. B. and Kose, O. and Aksulu, A. and Hacilarlioglu, S. and Erdogan, H. and Karagenc, T.",,,,,,,,,
Bamorovat,2015,"Bamorovat, M. and Sharifi, I. and Dabiri, S. and Mohammadi, M. A. and Har and i, M. F. and Mohebali, M. and Aflatoonian, M. R. and Keyhani, A.",,,,,,,,,
Bamorovat,2014,"Bamorovat, M. and Sharifi, I. and Mohammadi, M. A. and Har and i, M. F. and Mohebali, M. and Afshar, R. M. and Babaei, Z. and Ziaali, N. and Aflatoonian, M. R.",,,,,,,,,
Bar,2001,"Bar, M. E. and Wisnivesky-Colli, C.",,,,,,,,,
Barbosa,Na,"Barbosa, A. and Austen, J. and Gillett, A. and Warren, K. and Paparini, A. and Irwin, P. and Ryan, U.",,,,,,,,,
Barbosa,2017,"Barbosa, A. and Reiss, A. and Jackson, B. and Warren, K. and Paparini, A. and Gillespie, G. and Stokeld, D. and Irwin, P. and Ryan, U.",,,,,,,,,
Barbosa,2017,"Barbosa, A. D. and Gofton, A. W. and Paparini, A. and Codello, A. and Greay, T. and Gillett, A. and Warren, K. and Irwin, P. and Ryan, U.",,,,,,,,,
Barbosa-Silva,2019,"Barbosa-Silva, A. N. and de Souza, R. D. M. and Diotaiuti, L. and Aguiar, L. M. A. and da Camara, A. C. J. and Galvao, L. M. D. and Chiari, E.",,,,,,,,,
Barnard,2010,"Barnard, W. H. and Mettke-Hofmann, C. and Matsuoka, S. M.",,,,,,,,,
Barroso,2015,"Barroso, P. A. and Marco, J. D. and Locatelli, F. M. and Cardozo, R. M. and Hoyos, C. L. and Mora, M. C. and Bustos, M. F. G. and Lopez-Quiroga, I. and Mimori, T. and Gentile, A. G. and Barrio, A. B. and Korenaga, M. and Hashiguchi, Y. and Basombrio, M. A.",,,,,,,,,
Bashe,2010,"Bashe, S. K. R. and Abdullah, S. M. A.",,,,,,,,,
Baticados,2011,"Baticados, W. N. and Fern and ez, C. P. and Baticados, A. M.",,,,,,,,,
Batista,2007,"Batista, J. S. and Riet-Correa, F. and Teixeira, M. M. G. and Madruga, C. R. and Simoes, S. D. V. and Maia, T. F.",,,,,,,,,
Batista,2012,"Batista, J. S. and Rodrigues, C. M. F. and Olinda, R. G. and Silva, T. M. F. and Vale, R. G. and Camara, A. C. L. and Reboucas, R. E. S. and Bezerra, F. S. B. and Garcia, H. A. and Teixeira, M. M. G.",,,,,,,,,
Batistoti,2001,"Batistoti, M. and Cavazzana, M. and Serrano, M. G. and Ogatta, S. F. and Baccan, G. C. and Jankevicius, J. V. and Teixeira, M. M. G. and Jankevicius, S. T.",,,,,,,,,
Bears,2004,"Bears, H.",,,,,,,,,
Bekele,2011,"Bekele, M. and Nasir, M.",,,,,,,,,
Belo,2017,"Belo, V. S. and Gregorio, E. A. and Teixeira-Neto, R. G. and Lima, Acvmd and Pereira, A. A. S. and Marcelino, A. P. and Paz, G. F. and da Silva, E. S.",,,,,,,,,
Ben Othman,2018,"Ben Othman, S. and Ghawar, W. and Chaouch, M. and Ayari, C. and Chemkhi, J. and Cancino-Faure, B. and Tomas-Perez, M. and Alcover, M. M. and Riera, C. and Ben Salah, A. and Fisa, R. and Ben Ismail, R. and Ben Abderrazak, S.",,,,,,,,,
Benabid,2017,"Benabid, M. and Ghrab, J. and Rhim, A. and Ben-Romdhane, R. and Aoun, K. and Bouratbine, A.",,,,,,,,,
Benassi,2017,"Benassi, J. C. and Benvenga, G. U. and Ferreira, H. L. and Pereira, V. F. and Keid, L. B. and Soares, R. and Oliveira, Tmfd",,,,,,,,,
Bento,2018,"Bento, E. C. and Gomez-Hern and ez, C. and Batista, L. R. and Anversa, L. and Pedrosa, A. L. and Lages-Silva, E. and Ramirez, J. D. and Ramirez, L. E.",,,,,,,,,
Berger,2014,"Berger, R. and Wasserberg, G. and Warburg, A. and Orshan, L. and Kotler, B. P.",,,,,,,,,
Berlin,2012,"Berlin, D. and Nasereddin, A. and Azmi, K. and Ereqat, S. and Abdeen, Z. and Eyal, O. and Baneth, G.",,,,,,,,,
Bernal,2016,"Bernal, X. E. and Pinto, C. M.",,,,,,,,,
Berzunza-Cruz,2015,"Berzunza-Cruz, M. and Rodriguez-Moreno, A. and Gutierrez-Granados, G. and Gonzalez-Salazar, C. and Stephens, C. R. and Hidalgo-Mihart, M. and Marina, C. F. and Rebollar-Tellez, E. A. and Bailon-Martinez, D. and Balcells, C. D. and Ibarra-Cerdena, C. N. and Sanchez-Cordero, V. and Becker, I.",,,,,,,,,
Bett,2008,"Bett, B. and Irungu, P. and Nyamwaro, S. O. and Murilla, G. and Kitala, P. and Gathuma, J. and R and olph, T. F. and McDermott, J.",,,,,,,,,
Bettaieb,2014,"Bettaieb, J. and Toumi, A. and Chlif, S. and Chelghaf, B. and Boukthir, A. and Gharbi, A. and Ben Salah, A.",,,,,,,,,
Bezerra,2018,"Bezerra, C. M. and Barbosa, S. E. and de Souza, R. D. M. and Barezani, C. P. and Gurtler, R. E. and Ramos, A. N. and Diotaiuti, L.",,,,,,,,,
Bezerra,2014,"Bezerra, C. M. and Cavalcanti, L. P. D. and de Souza, R. D. M. and Barbosa, S. E. and Xavier, S. C. D. and Jansen, A. M. and Ramalho, R. D. and Diotaiuti, L.",,,,,,,,,
Bhattarai,2009,"Bhattarai, N. R. and Das, M. L. and Rijal, S. and van der Auwera, G. and Picado, A. and Khanal, B. and Roy, L. and Speybroeck, N. and Berkvens, D. and Davies, C. R. and Coosemans, M. and Boelaert, M. and Dujardin, J. C.",,,,,,,,,
Bhattarai,2010,"Bhattarai, N. R. and Van der Auwera, G. and Rijal, S. and Picado, A. and Speybroeck, N. and Khanal, B. and De Doncker, S. and Das, M. L. and Ostyn, B. and Davies, C. and Coosemans, M. and Berkvens, D. and Boelaert, M. and Dujardin, J. C.",,,,,,,,,
Bhutto,2010,"Bhutto, B. and Gadahi, J. A. and Shah, G. and Dewani, P. and Arijo, A. G.",,,,,,,,,
Bigeli,2012,"Bigeli, J. G. and de Oliveira, W. P. and Teles, N. M. M.",,,,,,,,,
Bilgin,2015,"Bilgin, Z. and Turan, N. and Yilmaz, H. and Ferroglio, E. and Tuzer, E.",,,,,,,,,
Birhanu,2015,"Birhanu, H. and Fikru, R. and Said, M. and Kidane, W. and Gebrehiwot, T. and Hagos, A. and Alemu, T. and Dawit, T. and Berkvens, D. and Goddeeris, B. M. and Buscher, P.",,,,,,,,,
Biryomumaisho,2013,"Biryomumaisho, S. and Rwakishaya, E. K. and Melville, S. E. and Cailleau, A. and Lubega, G. W.",,,,,,,,,
Biswas,2018,"Biswas, D. and Dolai, S. and Chowdhury, J. and Roy, P. K. and Grigorieva, E. V.",,,,,,,,,
Bitew,2011,"Bitew, M. and Amedie, Y. and Abebe, A. and Tolosa, T.",,,,,,,,,
Bizhga,2013,"Bizhga, B. and Laci, D. and Dhamo, G. and Keci, R. and Belegu, K. and Bakiasi, I. and Turmalaj, L.",,,,,,,,,
Bolukbas,2016,"Bolukbas, C. S. and Pekmezci, G. Z. and Gurler, A. T. and Pekmezci, D. and Guzel, M. and Hokelek, M. and Acici, M. and Umur, S.",,,,,,,,,
Bonfante-Cabarcas,2011,"Bonfante-Cabarcas, R. and Rodriguez-Bonfante, C. and Vielma, B. O. and Garcia, D. and Saldivia, A. M. and Aldana, E. and Curvelo, J. L. C.",,,,,,,,,
Borges,2014,"Borges, Lfnm and Lopes, E. G. P. and de Freitas, A. C. P. and Silva, M. X. and Haddad, J. P. A. and da Silva, J. A. and Nicolino, R. R. and Soares, D. F. D.",,,,,,,,,
Borghesan,Na,"Borghesan, T. C. and Campaner, M. and Matsumoto, T. E. and Espinosa, O. A. and Razafindranaivo, V. and Paiva, F. and Carranza, J. C. and A√±ez, N. and Neves, L. and Teixeira, M. M. G. and Camargo, E. P.",,,,,,,,,
Borji,2009,"Borji, H. and Razmi, G. and Par and eh, S.",,,,,,,,,
Botero,2013,"Botero, A. and Thompson, C. K. and Peacock, C. S. and Clode, P. L. and Nicholls, P. K. and Wayne, A. F. and Lymbery, A. J. and Thompson, R. C. A.",,,,,,,,,
Botto-Mahan,2012,"Botto-Mahan, C. and Bacigalupo, A. and Correa, J. P. and Oda, E. and Solari, A.",,,,,,,,,
Botto-Mahan,2015,"Botto-Mahan, C. and Rojo, G. and S and oval-Rodriguez, A. and Pena, F. and Ortiz, S. and Solari, A.",,,,,,,,,
Boushaki,2019,"Boushaki, D. and Adel, A. and Dia, M. L. and Buscher, P. and Madani, H. and Brihoum, B. A. and Sadaoui, H. and Bouayed, N. and Issad, N. K.",,,,,,,,,
Bovone,2005,"Bovone, N. S. and Fuente, M. C. and Eposto, M. O. and Londero, P.",,,,,,,,,
Bradley,2000,"Bradley, K. K. and Bergman, D. K. and Woods, J. P. and Crutcher, J. M. and Kirchhoff, L. V.",,,,,,,,,
Braga,2014,"Braga, A. R. C. and Correa, Apfl and Camossi, L. G. and da Silva, R. C. and Langoni, H. and Lucheis, S. B.",,,,,,,,,
Brasil,2018,"Brasil, A. W. D. and Machado, D. M. R. and da Silva, Marx and Barrosa, N. D. and Silva, R. B. S. and de Melo, M. A. and Langoni, H. and Santos, Cdab and de Azevedo, S. S.",,,,,,,,,
Bravo-Barriga,2016,"Bravo-Barriga, D. and Parreira, R. and Maia, C. and Afonso, M. O. and Blanco-Ciudad, J. and Serrano, F. J. and Perez-Martin, J. E. and Gomez-Gordo, L. and Campino, L. and Reina, D. and Frontera, E.",,,,,,,,,
Bray,2007,"Bray, D. P. and Bown, K. J. and Stockley, P. and Hurst, J. L. and Bennett, M. and Birtles, R. J.",,,,,,,,,
Breniere,2012,"Breniere, S. F. and Aliaga, C. and Waleckx, E. and Buitrago, R. and Salas, R. and Barnabe, C. and Tibayrenc, M. and Noireau, F.",,,,,,,,,
Brigada,2010,"Brigada, A. M. and Dona, R. and Caviedes-Vidal, E. and Moretti, E. and Basso, B.",,,,,,,,,
Brito,2016,"Brito, F. G. and Langoni, H. and da Silva, R. C. and Rotondano, T. E. D. and de Melo, M. A. and da Paz, G. S.",,,,,,,,,
Brown,2010,"Brown, E. L. and Roellig, D. M. and Gompper, M. E. and Monello, R. J. and Wenning, K. M. and Gabriel, M. W. and Yabsley, M. J.",,,,,,,,,
Bsrat,2015,"Bsrat, A. and Berhe, N. and Balkew, M. and Yohannes, M. and Teklu, T. and Gadisa, E. and Medhin, G. and Abera, A.",,,,,,,,,
Buechel,2016,"Buechel, S. D. and Schmid-Hempel, P.",,,,,,,,,
Buendia,2018,"Buendia, M. and Martin-Hern and ez, R. and Ornosa, C. and Barrios, L. and Bartolome, C. and Higes, M.",,,,,,,,,
Buhaya,2015,"Buhaya, M. H. and Galvan, S. and Maldonado, R. A.",,,,,,,,,
Bustamante,2014,"Bustamante, D. M. and De Urioste-Stone, S. M. and Juarez, J. G. and Pennington, P. M.",,,,,,,,,
Cadioli,2012,"Cadioli, F. A. and Barnabe, P. D. and Machado, R. Z. and Teixeira, M. C. A. and Andre, M. R. and Sampaio, P. H. and Fidelis, O. L. and Teixeira, M. M. G. and Marques, L. C.",,,,,,,,,
Cai,2019,"Cai, Y. and Wang, X. and Zhang, N. and Li, J. and Gong, P. and He, B. and Zhang, X.",,,,,,,,,
Caldart,2015,"Caldart, E. T. and Constantino, C. and Pasquali, A. K. S. and Benitez, A. D. and Hamada, F. N. and Dias, R. C. F. and Rorato-Nascimento, A. M. and Marana, E. R. M. and Navarro, I. T. and Mascarenhas, N. M. F. and de Freitas, J. C. and Freire, R. L.",,,,,,,,,
Caldart,2017,"Caldart, E. T. and Freire, R. L. and Ferreira, F. P. and Ruffolo, B. B. and Sbeghen, M. R. and Mareze, M. and Garcia, J. L. and Mitsuka-Bregano, R. and Navarro, I. T.",,,,,,,,,
Calzada,2015,"Calzada, J. E. and Saldana, A. and Gonzalez, K. and Rigg, C. and Pineda, V. and Santamaria, A. M. and Rodriguez, I. and Gottdenker, N. L. and Laurenti, M. D. and Chaves, L. F.",,,,,,,,,
Camejo,2016,"Camejo, M. I. and Aso, P. M. and Gonzatti, M. I. and Perez-Rojas, Y.",,,,,,,,,
Can,2016,"Can, H. and Doskaya, M. and Ozdemir, H. G. and Sahar, E. A. and Karakavuk, M. and Pektas, B. and Karakus, M. and Toz, S. and Caner, A. and Doskaya, A. D. and Iz, S. G. and Ozbel, Y. and Guruz, Y.",,,,,,,,,
Cardia,2013,"Cardia, D. F. F. and Camossi, L. G. and Neto, L. D. and Langoni, H. and Bresciani, K. D. S.",,,,,,,,,
Cardinal,2006,"Cardinal, M. V. and Castanera, M. B. and Lauricella, M. A. and Cecere, M. C. and Ceballos, L. A. and Vazquez-Prokopec, G. M. and Kitron, U. and Gurtler, R. E.",,,,,,,,,
Cardinal,2014,"Cardinal, M. V. and Orozco, M. M. and Enriquez, G. F. and Ceballos, L. A. and Gaspe, M. S. and Alvarado-Otegui, J. A. and Gurevitz, J. M. and Kitron, U. and Gurtler, R. E.",,,,,,,,,
Cardoso,2015,"Cardoso, L. and Gilad, M. and Cortes, H. C. E. and Nachum-Biala, Y. and Lopes, A. P. and Vila-Vicosa, M. J. and Simoes, M. and Rodrigues, P. A. and Baneth, G.",,,,,,,,,
Cardoso,2010,"Cardoso, L. and Lopes, A. P. and Sherry, K. and Schallig, H. and Solano-Gallego, L.",,,,,,,,,
Cardoso,2004,"Cardoso, L. and Rodrigues, M. and Santos, H. and Schoone, G. J. and Carreta, P. and Varejao, E. and van Benthem, B. and Afonso, M. O. and Alves-Pires, C. and Semiao-Santos, S. J. and Rodrigues, J. and Schallig, Hdfh",,,,,,,,,
Cardoso,2004,"Cardoso, L. and Schallig, Hdfh and Neto, F. and Kroon, N. and Rodrigues, M.",,,,,,,,,
Cardoso,2015,"Cardoso, R. M. and de Araujo, Nnsl and Romero, G. A. S. and Souza, Ttcm and Dietrich, A. G. and Mendes, J. D. and Reis, M. L. and Ferreira, J. B. C. and Hecht, M. M. and Gurgel-Goncalves, R.",,,,,,,,,
Carhuallanqui,2017,"Carhuallanqui, A. and Chavez, A. and Pinedo, R.",,,,,,,,,
Carleton,2012,"Carleton, R. E. and Mertins, J. W. and Yabsley, M. J.",,,,,,,,,
Carlson,2013,"Carlson, J. S. and Martinez-Gomez, J. E. and Valkiunas, G. and Loiseau, C. and Bell, D. A. and Sehgal, R. N. M.",,,,,,,,,
Carnevali,2017,"Carnevali, V. and Nogueda-Torres, B. and Villagran-Herrera, M. E. and De Diego-Cabrera, J. A. and Rocha-Chavez, G. and Martinez-Ibarra, J. A.",,,,,,,,,
Carreira,2012,"Carreira, J. C. A. and da Silva, A. V. M. and Pereira, D. D. and Brazil, R. P.",,,,,,,,,
Carslake,2017,"Carslake, R. J. and Hill, K. E. and Sjol and er, K. and Hii, S. F. and Prattley, D. and Acke, E.",,,,,,,,,
Carvalho,2015,"Carvalho, F. S. and Wenceslau, A. A. and Albuquerque, G. R. and Munhoz, A. D. and Gross, E. and Carneiro, P. L. S. and Oliveira, H. C. and Rocha, J. M. and Santos, I. A. and Rezende, R. P.",,,,,,,,,
Cassini,2013,"Cassini, R. and Signorini, M. and di Regalbono, A. F. and Natale, A. and Montarsi, F. and Zanaica, M. and Brichese, M. and Simonato, G. and Borgato, S. and Babiker, A. and Pietrobelli, M.",,,,,,,,,
Castillo-Neyra,2015,"Castillo-Neyra, R. and Chu, L. C. and Quispe-Machaca, V. and Ancca-Juarez, J. and Chavez, F. S. M. and Mazuelos, M. B. and Naquira, C. and Bern, C. and Gilman, R. H. and Levy, M. Z.",,,,,,,,,
Castro,2007,"Castro, E. A. and Thomaz-Soccoi, V. and Augur, C. and Luz, E.",,,,,,,,,
Castro,2019,"Castro, J. C. and Bueno, L. L. and Milagres, T. F. and Rego, F. D. and Gontijo, C. M. F. and Peconick, A. P. and Andrade, A. J. and Barcante, T. A. and Barcante, J. M. P.",,,,,,,,,
Catarino,2001,"Catarino, L. M. and Serrano, M. G. and Cavazzana, M. and Almeida, M. L. and Kaneshina, E. K. and Campaner, M. and Jankevicius, J. V. and Teixeira, M. M. G. and Itow-Jankevicius, S.",,,,,,,,,
Cavigli,2016,"Cavigli, I. and Daughenbaugh, K. F. and Martin, M. and Lerch, M. and Banner, K. and Garcia, E. and Brutscher, L. M. and Flenniken, M. L.",,,,,,,,,
Ceballos,2006,"Ceballos, L. A. and Cardinal, M. V. and Vazquez-Prokopec, G. M. and Lauricella, M. A. and Orozco, M. M. and Cortinas, R. and Schijman, A. G. and Levin, M. J. and Kitron, U. and Gurtler, R. E.",,,,,,,,,
Ceballos,2005,"Ceballos, L. A. and Vazquez-Prokopec, G. M. and Cardinal, V. M. and Orozco, M. M. and Cortinas, R. and Kitron, U. and Gurtler, R. E.",,,,,,,,,
Chagas,2018,"Chagas, E. C. D. S. and Silva, A. S. and F√©, N. F. and Ferreira, L. S. and Sampaio, V. D. S. and Terrazas, W. C. M. and Guerra, J. A. O. and Souza, R. A. F. D. and Silveira, H. and Guerra, M. D. G. V. B.",,,,,,,,,
Chargui,2009,"Chargui, N. and Haouas, N. and Gorcii, W. and Lahmar, S. and Guesmi, M. and Ben Abdelhafidh, A. and Mezhoud, H. and Babba, H.",,,,,,,,,
Chargui,2013,"Chargui, N. and Haouas, N. and Slama, D. and Gorcii, M. and Jaouadi, K. and Essabbah-Aguir, N. and Mezhoud, H. and Babba, H.",,,,,,,,,
Chargui,2018,"Chargui, N. and Slama, D. and Haouas, N. and Rmadi, L. and Babba, H.",,,,,,,,,
Charles,2013,"Charles, R. A. and Kjos, S. and Ellis, A. E. and Barnes, J. C. and Yabsley, M. J.",,,,,,,,,
Chatzis,2014,"Chatzis, M. K. and Andreadou, M. and Leontides, L. and Kasabalis, D. and Mylonakis, M. and Koutinas, A. F. and Rallis, T. and Ikonomopoulos, J. and Saridomichelakis, M. N.",,,,,,,,,
Chaudhary,2000,"Chaudhary, Z. I. and Iqbal, J.",,,,,,,,,
Chaudhri,2013,"Chaudhri, S. S. and Bisla, R. S. and Bhanot, V. and Singh, H.",,,,,,,,,
Chaudhry,2008,"Chaudhry, Z. I. and Jahanzaib and Aslam, A. and Ahmed, I.",,,,,,,,,
Chemkhi,2015,"Chemkhi, J. and Souguir, H. and Ali, I. B. H. and Driss, M. and Guizani, I. and Guerbouj, S.",,,,,,,,,
Chemuliti,2003,"Chemuliti, J. K. and Njiru, Z. K. and Bukachi, S.",,,,,,,,,
Chen,2019,"Chen, H. and Li, J. and Zhang, J. R. and Guo, X. G. and Liu, J. L. and He, J. L. and Song, Q. and Zhang, J. H. and Chen, M. L. and Zheng, Z. W. and Chen, D. and Chen, J. P.",,,,,,,,,
Cherenet,2004,"Cherenet, T. and Sani, R. A. and Pan and am, J. M. and Nadzr, S. and Speybroeck, N. and Van Den Bossche, P.",,,,,,,,,
Cherenet,2006,"Cherenet, T. and Sani, R. A. and Speybroeck, N. and Pan and am, J. M. and Nadzr, S. and Van den Bossche, P.",,,,,,,,,
Chikweto,2014,"Chikweto, A. and Kumthekar, S. and Chawla, P. and Tiwari, K. P. and Perea, L. M. and Paterson, T. and Sharma, R. N.",,,,,,,,,
Chitimia,2011,"Chitimia, L. and Munoz-Garcia, C. I. and Sanchez-Velasco, D. and Lizana, V. and del Rio, L. and Murcia, L. and Fisa, R. and Riera, C. and Gimenez-Font, P. and Jimenez-Montalban, P. and Martinez-Ramirez, A. and Meseguer-Meseguer, J. M. and Garcia-Bacete, I. and Sanchez-Isarria, M. A. and Sanchis-Monsonis, G. and Garcia-Martinez, J. D. and Vicente, V. and Segovia, M. and Berriatua, E.", G. and Garcia-Martinez, J. D. and Vicente, V. and Segovia, M. and Berriatua, E.,,,,
Chochlios,2019,"Chochlios, T. A. and Angelidou, E. and Kritsepi-Konstantinou, M. and Koutinas, C. K. and Mylonakis, M. E.",,,,,,,,,
Chowdhury,2005,"Chowdhury, P. and Biswas, U. and Guha, C. and Jana, P. S.",,,,,,,,,
Cimino,2011,"Cimino, R. O. and Rumi, M. M. and Ragone, P. and Lauthier, J. and D'Amato, A. A. and Quiroga, I. R. L. and Gil, J. F. and Cajal, S. P. and Acosta, N. and Juarez, M. and Krolewiecki, A. and Orellana, V. and Zacca, R. and Marcipar, I. and Diosque, P. and Nasser, J. R.", P. and Nasser, J. R.,,,,,,,
Clausen,2003,"Clausen, P. H. and Chuluun, S. and Sodnomdarjaa, R. and Greiner, M. and Noeckler, K. and Staak, C. and Zessin, K. H. and Schein, E.",,,,,,,,,
