First,Year,Authors,,,,,,,,,
Godoi,2002,"Godoi, M. M. I. and Serrano, M. G. and Teixeira, M. M. G. and Camargo, E. P.",,,,,,,,,
Gomez-Hern and ez,2008,"Gomez-Hern and ez, C. and Rezende-Oliveira, K. and Zarate, A. C. and Zarate, E. C. and Trujillo-Contreras, F. and Ramirez, L. E.",,,,,,,,,
Goncalves,2009,"Goncalves, T. C. M. and Freitas, A. L. C. and Freitas, S. P. C.",,,,,,,,,
Gontijo,2002,"Gontijo, C. M. F. and da Silva, E. S. and de Fuccio, M. B. and de Sousa, M. C. A. and Pacheco, R. S. and Dias, E. S. and Filho, J. D. A. and Brazil, R. P. and Melo, M. N.",,,,,,,,,
Gonzales,2007,"Gonzales, J. L. and Chacon, E. and Mir and a, M. and Loza, A. and Siles, L. M.",,,,,,,,,
Goossens,2006,"Goossens, B. and Mbwambo, H. and Msangi, A. and Geysen, D. and Vreysen, M.",,,,,,,,,
Gorchakov,2016,"Gorchakov, R. and Trosclair, L. P. and Wozniak, E. J. and Feria, P. T. and Garcia, M. N. and Gunter, S. M. and Murray, K. O.",,,,,,,,,
Gotsch,2009,"Gotsch, S. and Leschnik, M. and Duscher, G. and Burgstaller, J. P. and Wille-Piazzai, W. and Joachim, A.",,,,,,,,,
Goulson,2018,"Goulson, D. and O'Connor, S. and Park, K. J.",,,,,,,,,
Goulson,2012,"Goulson, D. and Whitehorn, P. and Fowley, M.",,,,,,,,,
Graystock,2014,"Graystock, P. and Goulson, D. and Hughes, W. O. H.",,,,,,,,,
Grijalva,2003,"Grijalva, M. J. and Escalante, L. and Paredes, R. A. and Costales, J. A. and Padilla, A. and Rowl and , E. C. and Aguilar, H. M. and Racines, J.",,,,,,,,,
Grijalva,2015,"Grijalva, M. J. and Villacis, A. G. and Ocana-Mayorga, S. and Yumiseva, C. A. and Moncayo, A. L. and Baus, E. G.",,,,,,,,,
Grisard,2000,"Grisard, E. C. and Carvalho-Pinto, C. J. and Scholz, A. F. and Toma, H. K. and Schlemper, B. R. and Steindel, M.",,,,,,,,,
Grybchuk-Ieremenko,2014,"Grybchuk-Ieremenko, A. and Losev, A. and Kostygov, A. Y. and Lukes, J. and Yurchenko, V.",,,,,,,,,
Guedegbe,1992,"Guedegbe, B. and Verhulst, A. and Vanmeirvenne, N. and P and ey, V. S. and Doko, A.",,,,,,,,,
Guerbouj,2014,"Guerbouj, S. and Djilani, F. and Bettaieb, J. and Lambson, B. and Diouani, M. F. and Ben Salah, A. and Ben Ismail, R. and Guizani, I.",,,,,,,,,
Guerra,2013,"Guerra, N. R. and Monteiro, M. F. M. and S and es, H. M. M. and da Cruz, N. L. N. and Ramos, C. A. N. and Santana, V. L. D. and de Souza, M. M. A. and Alves, L. C.",,,,,,,,,
Guimaraes,2005,"Guimaraes, K. S. and Batista, Z. S. and Dias, E. L. and Guerra, Rmsnc and Costa, A. D. C. and Oliveira, A. S. and Calabrese, K. S. and Cardoso, F. O. and Souza, C. S. F. and do Vale, T. Z. and da Costa, S. C. G. and Abreu-Silva, A. L.",,,,,,,,,
Gunasekara,2019,"Gunasekara, E. and Sivakumar, T. and Kothalawala, H. and Abeysekera, T. S. and Weerasingha, A. S. and Vimalakumar, S. C. and Kanagaratnam, R. and Yapa, P. R. and Zhyldyz, A. and Igarashi, I. and Silva, S. S. P. and Yokoyama, N.",,,,,,,,,
Gurtler,1996,"Gurtler, R. E. and Cecere, M. C. and Castanera, M. B. and Canale, D. and Lauricella, M. A. and Chuit, R. and Cohen, J. E. and Segura, E. L.",,,,,,,,,
G√ºrtler,2007,"G√ºrtler, R. E. and Cecere, M. C. and Lauricella, M. A. and Cardinal, M. V. and Kitron, U. and Cohen, J. E.",,,,,,,,,
Gutierrez,2000,"Gutierrez, C. and Juste, M. C. and Corbera, J. A. and Magnus, E. and Verloo, D. and Montoya, J. A.",,,,,,,,,
Haas,2012,"Haas, M. and Lukan, M. and Kiskova, J. and Hrehova, Z.",,,,,,,,,
Haenen,2010,"Haenen, O. L. M. and Lehmann, J. and Engelsma, M. Y. and Sturenberg, F. J. and Roozenburg, I. and Kerkhoff, S. and Breteler, J. K.",,,,,,,,,
Hagos,2010,"Hagos, A. and Abebe, G. and Buscher, P. and Goddeeris, B. M. and Claes, F.",,,,,,,,,
Hagos,2010,"Hagos, A. and Degefa, G. and Yacob, H. and Fikru, R. and Alemu, T. and Feseha, G. and Claes, F. and Goddeeris, B. M.",,,,,,,,,
Haji,2014,"Haji, I. J. and Malele, I. and Namangala, B.",,,,,,,,,
Haji,2015,"Haji, I. J. and Sugimoto, C. and Kajino, K. and Malele, I. and Simukoko, H. and Chitambo, H. and Namangala, B.",,,,,,,,,
Hall,2007,"Hall, C. A. and Polizzi, C. and Yabsley, M. J. and Norton, T. M.",,,,,,,,,
Hamad,2015,"Hamad, I. and Forestier, C. L. and Peeters, M. and Delaporte, E. and Raoult, D. and Bittar, F.",,,,,,,,,
Hamarsheh,2012,"Hamarsheh, O. and Nasereddin, A. and Damaj, S. and Sawalha, S. and Al-Jawabreh, H. and Azmi, K. and Amro, A. and Ereqat, S. and Abdeen, Z. and Al-Jawabreh, A.",,,,,,,,,
Hamel,2011,"Hamel, D. and Rohrig, E. and Pfister, K.",,,,,,,,,
Hamel,2016,"Hamel, D. and Shukullari, E. and Rapti, D. and Silaghi, C. and Pfister, K. and Rehbein, S.",,,,,,,,,
Hamill,2017,"Hamill, L. and Picozzi, K. and Fyfe, J. and von Wissmann, B. and Wastling, S. and Wardrop, N. and Selby, R. and Acup, C. A. and Bardosh, K. L. and Muhanguzi, D. and Kabasa, J. D. and Waiswa, C. and Welburn, S. C.",,,,,,,,,
Hamill,2013,"Hamill, L. C. and Kaare, M. T. and Welburn, S. C. and Picozzi, K.",,,,,,,,,
Hancock,2005,"Hancock, K. and Zajac, A. M. and Pung, O. J. and Elvinger, F. and Rosypal, A. C. and Lindsay, D. S.",,,,,,,,,
Hanel,2016,"Hanel, J. and Dolezalova, J. and Stehlikova, S. and Modry, D. and Chudoba, J. and Synek, P. and Votypka, J.",,,,,,,,,
Hassan,2009,"Hassan, M. M. and Osman, O. F. and El-Raba'a, F. M. A. and Schallig, Hdfh and Elnaiem, D. E. A.",,,,,,,,,
Hern and ez,2016,"Hern and ez, C. and Salazar, C. and Brochero, H. and Teheran, A. and Buitrago, L. S. and Vera, M. and Soto, H. and Florez-Rivadeneira, Z. and Ardila, S. and Parra-Henao, G. and Ramirez, J. D.",,,,,,,,,
Herrera,2015,"Herrera, C. P. and Licon, M. H. and Nation, C. S. and Jameson, S. B. and Wesson, D. M.",,,,,,,,,
Herrera,2017,"Herrera, E. A. and Castro, Y.",,,,,,,,,
Herrera,2005,"Herrera, L. and D'Andrea, P. S. and Xavier, S. C. C. and Mangia, R. H. and Fern and es, O. and Jansen, A. M.",,,,,,,,,
Herrera,2009,"Herrera, M. and Soto, A. and Urrego, V. and Rivera, G. and Zapata, M. and Rios, L.",,,,,,,,,
Heusser,2010,"Heusser, A. and Bellato, V. and de Souza, A. P. and de Moura, A. B. and Sartor, A. A. and Santos, Egob and Silva, V. L.",,,,,,,,,
Hirsch,2008,"Hirsch, M. and Pantchev, N.",,,,,,,,,
Hodo,2016,"Hodo, C. L. and Goodwin, C. C. and Mayes, B. C. and Mariscal, J. A. and Waldrup, K. A. and Hamer, S. A.",,,,,,,,,
Hodo,2019,"Hodo, C. L. and Rodriguez, J. Y. and Curtis-Robles, R. and Zecca, I. B. and Snowden, K. F. and Cunnnnings, K. J. and Hamer, S. A.",,,,,,,,,
Hodzic,2018,"Hodzic, A. and Mrowietz, N. and Cezanne, R. and Bruckschwaiger, P. and Punz, S. and Habler, V. E. and Tomsik, V. and Lazar, J. and Duscher, G. G. and Glawischnig, W. and Fuehrer, H. P.",,,,,,,,,
Hofmann,2019,"Hofmann, M. and Hodzic, A. and Pouliou, N. and Joachim, A.",,,,,,,,,
Holl and ,2004,"Holl and , W. G. and Thanh, N. G. and My, L. N. and Do, T. T. and Goddeeris, B. M. and Vercruysse, J.",,,,,,,,,
Holmstad,2003,"Holmstad, P. R. and Anwar, A. and Lezhova, T. and Skorping, A.",,,,,,,,,
Hopkins,1998,"Hopkins, J. S. and Chitambo, H. and Machila, N. and Luckins, A. G. and Rae, P. F. and van den Bossche, P. and Eisler, M. C.",,,,,,,,,
Hopkins,2019,"Hopkins, T. and Gon√ßalves, R. and Mamani, J. and Courtenay, O. and Bern, C.",,,,,,,,,
Hosseininejad,2012,"Hosseininejad, M. and Mohebali, M. and Hosseini, F. and Karimi, S. and Sharifzad, S. and Akhoundi, B.",,,,,,,,,
Houk,2010,"Houk, A. E. and Goodwin, D. G. and Zajac, A. M. and Barr, S. C. and Dubey, J. P. and Lindsay, D. S.",,,,,,,,,
Hubalek,2003,"Hubalek, Z. and Stunzner, D. and Halouzka, J. and Sixl, W. and Wendelin, I. and Juricova, Z. and Sanogo, Y. O.",,,,,,,,,
Hussain,2016,"Hussain, M. and Saeed, Z. and Gulsher, M. and Shaikh, R. S. and Ali, M. and Ahmad, A. N. and Hussain, I. and Akhtar, M. and Iqbal, F.",,,,,,,,,
Hussain,2016,"Hussain, M. and Saeed, Z. and Gulsher, M. and Shaikh, R. S. and Ali, M. and Akhtar, M. and Iqbal, F.",,,,,,,,,
Hussain,2018,"Hussain, R. and Khan, A. and Jahanzaib and Qayyum, A. and Abbas, T. and Ahmad, M. and Mohiuddin, M. and Mehmood, K.",,,,,,,,,
Isaac,2016,"Isaac, C. and Ciosi, M. and Hamilton, A. and Scullion, K. M. and Dede, P. and Igbinosa, I. B. and Nmorsi, O. P. G. and Masiga, D. and Turner, C. M. R.",,,,,,,,,
Jabal-Uriel,Na,"Jabal-Uriel, C. and Mart√≠n-Hern√°ndez, R. and Ornosa, C. and Higes, M. and Berriat√∫a, E. and De la R√∫a, P.",,,,,,,,,
Jafari,2013,"Jafari, R. and Najafzadeh, N. and Sedaghat, M. M. and Patvizi, P.",,,,,,,,,
Jaimes-Duenez,2017,"Jaimes-Duenez, J. and Triana-Chavez, O. and Mejia-Jaramillo, A. M.",,,,,,,,,
Jaimes-Duenez,2018,"Jaimes-Duenez, J. and Triana-Chavez, O. and Mejia-Jaramillo, A. M.",,,,,,,,,
Jakes,2001,"Jakes, K. A. and O'Donoghue, P. and Munro, M. and Adlard, R.",,,,,,,,,
Jansen,2018,"Jansen, A. M. and Xavier, S. C. D. and Roque, A. L. R.",,,,,,,,,
Jiang,2016,"Jiang, W. and Wang, Y. and Liu, Y. C. and Li, T. and Chen, Y. J. and Wang, S. H. and Han, X. G. and Wang, Q.",,,,,,,,,
Jimenez-Coello,2015,"Jimenez-Coello, M. and Acosta-Viana, K. and Guzman-Marin, E. and Barcenas-Irabien, A. and Ortega-Pacheco, A.",,,,,,,,,
Jimenez-Coello,2012,"Jimenez-Coello, M. and Acosta-Viana, K. Y. and Guzman-Marin, E. and Gomez-Rios, A. and Ortega-Pacheco, A.",,,,,,,,,
Jimenez-Coello,2010,"Jimenez-Coello, M. and Ortega-Pacheco, A. and Guzman-Marin, E. and Guiris-Andrade, D. M. and Martinez-Figueroa, L. and Acosta-Viana, K. Y.",,,,,,,,,
Jimenez-Coello,2008,"Jimenez-Coello, M. and Poot-Cob, M. and Ortega-Pacheco, A. and Guzman-Marin, E. and Ramos-Ligonio, A. and Sauri-Arceo, C. H. and Acosta-Viana, K. Y.",,,,,,,,,
Juliao,2007,"Juliao, F. S. and Souza, Bmps and Freitas, D. S. and Oliveira, L. S. and Larangeira, D. F. and Dias-Lima, A. G. and Souza, V. M. M. and Barrouin-Melo, S. M. and Moreira, E. D. and Paule, B. J. A. and Franke, C. R.",,,,,,,,,
Kaabi,2018,"Kaabi, B. and Zhioua, E.",,,,,,,,,
Kalayou,2011,"Kalayou, S. and Tadelle, H. and Bsrat, A. and Abebe, N. and Haileselassie, M. and Schallig, Hdfh",,,,,,,,,
Kame-Ngasse,2018,"Kame-Ngasse, G. I. and Njiokou, F. and Melachio-Tanekou, T. T. and Farikou, O. and Simo, G. and Geiger, A.",,,,,,,,,
Karakus,2019,"Karakus, M. and Arserim, S. K. and Kasap, O. E. and Pekagirbas, M. and Akuzum, D. and Alten, B. and Toz, S. and Ozbel, Y.",,,,,,,,,
Karakus,2015,"Karakus, M. and Toz, S. and Ertabaklar, H. and Pasa, S. and Atasoy, A. and Arserim, S. K. and Olgen, M. K. and Alkan, M. Z. and Durrant, C. and Ozbel, Y.",,,,,,,,,
Karbowiak,2005,"Karbowiak, G. and Rychlik, L. and Nowakowski, W. and Wita, I.",,,,,,,,,
Karbowiak,2009,"Karbowiak, G. and Stanko, M. and Fricova, J. and Wita, I. and Hapunik, J. and Petko, B.",,,,,,,,,
Karbowiak,2005,"Karbowiak, G. and Wita, I. and Rychlik, L.",,,,,,,,,
Kardjadj,2019,"Kardjadj, M. and Ben-Mahdi, M. H.",,,,,,,,,
Karimuribo,2011,"Karimuribo, E. D. and Morrison, L. J. and Black, A. and Turner, C. M. R. and Kambarage, D. M. and Ballingall, K. T.",,,,,,,,,
Karlsbakk,2004,"Karlsbakk, E.",,,,,,,,,
Karshima,2016,"Karshima, S. N. and Ajogi, I. and Mohammed, G.",,,,,,,,,
Kassa,2011,"Kassa, T. and Eguale, T. and Chaka, H.",,,,,,,,,
Kassahun,2015,"Kassahun, A. and Sadlova, J. and Dvorak, V. and Kostalova, T. and Rohousova, I. and Frynta, D. and Aghova, T. and Yasur-L and au, D. and Lemma, W. and Hailu, A. and Baneth, G. and Warburg, A. and Volf, P. and Votypka, J.",,,,,,,,,
Katakweba,2012,"Katakweba, A. A. S. and Mulungu, L. S. and Eiseb, S. J. and Mahlaba, T. A. and Makundi, R. H. and Massawe, A. W. and Borremans, B. and Belmain, S. R.",,,,,,,,,
Kato,2008,"Kato, H. and Caceres, A. G. and Gomez, E. A. and Mimori, T. and Uezato, H. and Marco, J. D. and Barroso, P. A. and Iwata, H. and Hashiguchi, Y.",,,,,,,,,
Kato,2016,"Kato, H. and Caceres, A. G. and Hashiguchi, Y.",,,,,,,,,
Kato,2007,"Kato, H. and Uezato, H. and Gomez, E. A. and Terayama, Y. and Calvopina, M. and Iwata, H. and Hashiguchi, Y.",,,,,,,,,
Kazimoto,Na,"Kazimoto, T. A. and Amora, S. S. A. and Figueiredo, F. B. and Magalh√£es, J. M. E. and Freitas, Y. B. N. and Sousa, M. L. R. and Melo, A. E. C. D. S. and Campos, M. P. and Alves, N. D. and Werneck, G. L.",,,,,,,,,
Keck,2003,"Keck, N. and Dereuer, J.",,,,,,,,,
Kelly,2018,"Kelly, E. and Barbosa, A. D. and Gibson-Kueh, S. and Lymbery, A. J.",,,,,,,,,
Kenubih,2015,"Kenubih, A. and Dagnachew, S. and Almaw, G. and Abebe, T. and Takele, Y. and Hailu, A. and Lemma, W.",,,,,,,,,
Khan,2018,"Khan, A. U. and Qureshi, A. S. and Hassan, M. F. and Rehan, S. and Sarfraz, A.",,,,,,,,,
Khanmohammadi,2010,"Khanmohammadi, M. and Fallah, E. and Rahbari, S. and Sohrabi, I. and Farshchian, M. and Hamzavi, F. and Asl, A. M.",,,,,,,,,
Khanmohammadi,2010,"Khanmohammadi, M. and Fallah, E. and Rahbari, S. and Sohrabi, I. and Farshchian, M. and Hamzavi, F. and Asl, A. M.",,,,,,,,,
Kidanemariam,2002,"Kidanemariam, A. and Hadgu, K. and Sahle, M.",,,,,,,,,
Kilic,2008,"Kilic, S. and Babur, C. and Ozkan, A. T. and Mamak, N.",,,,,,,,,
Kissinger,2011,"Kissinger, C. N. and Cameron, S. A. and Thorp, R. W. and White, B. and Solter, L. F.",,,,,,,,,
Kjos,2008,"Kjos, S. A. and Snowden, K. F. and Craig, T. M. and Lewis, B. and Ronald, N. and Olson, J. K.",,,,,,,,,
Kocher,2015,"Kocher, A. and Desquesnes, M. and Kamyingkird, K. and Yangtara, S. and Leboucher, E. and Rodtian, P. and Dargantes, A. and Jittapalapong, S.",,,,,,,,,
Koirala,2004,"Koirala, S. and Karki, P. and Das, M. L. and Parija, S. C. and Karki, B. M. S.",,,,,,,,,
Korner,2005,"Korner, P. and Schmid-Hempel, P.",,,,,,,,,
Kouam,2010,"Kouam, M. K. and Diakou, A. and Kanzoura, V. and Papadopoulos, E. and Gajadhar, A. A. and Theodoropoulos, G.",,,,,,,,,
Kovalenko,2011,"Kovalenko, D. A. and Razakov, S. A. and Ponirovsky, E. N. and Warburg, A. and Nasyrova, R. M. and Ponomareva, V. I. and Fatullaeva, A. A. and Nasereddin, A. and Klement, E. and Alam, M. Z. and Schnur, L. F. and Jaffe, C. L. and Schonian, G. and Baneth, G.",,,,,,,,,
Kozminsky,2015,"Kozminsky, E. and Kraeva, N. and Ishemgulova, A. and Dobakova, E. and Lukes, J. and Kment, P. and Yurchenko, V. and Votypka, J. and Maslov, D. A.",,,,,,,,,
Kramm,2017,"Kramm, M. M. and Gutierrez, M. R. and Luepke, T. D. and Soria, C. and Lopez, R. R. and Cooper, S. M. and Davis, D. S. and Parker, I. D.",,,,,,,,,
Krone,2001,"Krone, O. and Priemer, J. and Streich, J. and Sommer, P. and Langgemach, T. and Lessow, O.",,,,,,,,,
Kubacka,Na,"Kubacka, J. and Gerl√©e, A. and Foucher, J. and Korb, J. and Podmok≈Ça, E.",,,,,,,,,
Kubi,2007,"Kubi, C. and Billiouw, M. and Van den Bossche, P.",,,,,,,,,
Kundu,2013,"Kundu, K. and Tewari, A. K. and Kurup, S. P. and Baidya, S. and Rao, J. R. and Joshi, P.",,,,,,,,,
Laha,2008,"Laha, R. and Sasmal, N. K.",,,,,,,,,
Lamattina,2019,"Lamattina, D. and Berrozpe, P. E. and Casas, N. and Moya, S. L. and Giuliani, M. G. and Costa, S. A. and Arrabal, J. P. and Martinez, M. F. and Rivero, M. R. and Salas, M. and Humeres, C. A. and Liotta, D. J. and Meichtry, M. B. and Salomon, O. D.",,,,,,,,,
Lana,2018,"Lana, R. S. and Michalsky, E. M. and Lopes, L. O. and Lara-Silva, F. O. and Nascimento, J. L. and Pinheiro, L. C. and Fran√ßa-Silva, J. C. and Mendes, T. S. C. and Fortes-Dias, C. L. and Dias, E. S.",,,,,,,,,
Laohasinnarong,2015,"Laohasinnarong, D. and Goto, Y. and Asada, M. and Nakao, R. and Hayashida, K. and Kajino, K. and Kawazu, S. and Sugimoto, C. and Inoue, N. and Namangala, B.",,,,,,,,,
Laohasinnarong,2011,"Laohasinnarong, D. and Thekisoe, O. M. M. and Malele, I. and Namangala, B. and Ishii, A. and Goto, Y. and Kawazu, S. and Sugimoto, C. and Inoue, N.",,,,,,,,,
Laranjeira,2014,"Laranjeira, D. F. and da Matta, V. L. R. and Tomokane, T. Y. and Marcondes, M. and Corbet, C. E. P. and Laurenti, M. D.",,,,,,,,,
Lardeux,2016,"Lardeux, F. and Aliaga, C. and Depickere, S.",,,,,,,,,
Lashari,2018,"Lashari, M. H. and Ghouri, M. T. and Akhtar, M. S. and Kamran, Z. and Chaudhari, M. S. and Ayaz, M. and Farooq, A. A. and Sarwar, G.",,,,,,,,,
Latif,2019,"Latif, A. A. and Ntantiso, L. and de Beer, C.",,,,,,,,,
Lauricella,2005,"Lauricella, M. A. and Stariolo, R. L. and Riarte, A. R. and Segura, E. L. and Gurtler, R. E.",,,,,,,,,
Leal,2018,"Leal, G. G. D. and Carneiro, M. and Pinheiro, A. D. and Marques, L. A. and Ker, H. G. and Reis, A. B. and Coura-Vital, W.",,,,,,,,,
Leca,2015,"Leca, N. F. and Guedes, P. E. B. and Santana, L. N. and Almeida, V. D. and Carvalho, F. S. and Albuquerque, G. R. and Wenceslau, A. A. and Munhoz, A. D. and Silva, F. L.",,,,,,,,,
Ledesma,2017,"Ledesma, D. and Berriatua, E. and Thomas, M. C. and Bernal, L. J. and Ortuno, M. and Benitez, C. and Egui, A. and Papasouliotis, K. and Tennant, B. and Chambers, J. and Infante, J. J. and Lopez, M. C.",,,,,,,,,
Lelisa,2014,"Lelisa, K. and Shimeles, S. and Bekele, J. and Sheferaw, D.",,,,,,,,,
Lemma,2017,"Lemma, W. and Bizuneh, A. and Tekie, H. and Belay, H. and Wondimu, H. and Kassahun, A. and Shiferaw, W. and Balkew, M. and Abassi, I. and Baneth, G. and Hailu, A.",,,,,,,,,
Leontides,2002,"Leontides, L. S. and Saridomichelakis, M. N. and Billinis, C. and Kontos, V. and Koutinas, A. F. and Galatos, A. D. and Mylonakis, M. E.",,,,,,,,,
Leppert,2008,"Leppert, L. L. and Dufty, A. M. and Stock, S. and Oleyar, M. D. and Kaltenecker, G. S.",,,,,,,,,
Levy,2006,"Levy, M. Z. and Bowman, N. M. and Kawai, V. and Waller, L. A. and del Carpio, J. G. C. and Benzaquen, E. C. and Gilman, R. H. and Bern, C.",,,,,,,,,
Lima,2013,"Lima, B. S. and Dantas-Torres, F. and de Carvalho, M. R. and Marinho, J. F. and de Almeida, E. L. and Brito, M. E. F. and Gomes, F. and Br and ao, S. P.",,,,,,,,,
Lima,2012,"Lima, M. M. and Sarquis, O. and de Oliveira, T. G. and Gomes, T. F. and Coutinho, C. and Daflon-Teixeira, N. F. and Toma, H. K. and Britto, C. and Teixeira, B. R. and D'Andrea, P. S. and Jansen, A. M. and Boia, M. N. and Carvalho-Costa, F. A.",,,,,,,,,
Lima-Oliveira,2020,"Lima-Oliveira, T. M. and Fontes, F. V. H. M. and Lilioso, M. and Pires-Silva, D. and Teixeira, M. M. G. and Meza, J. G. V. and Harry, M. and File√©, J. and Costa, J. and Valen√ßa-Barbosa, C. and Folly-Ramos, E. and Almeida, C. E.",,,,,,,,,
Lins,2018,"Lins, T. N. B. and de Souza, I. B. and Barros, Gmmd and dos Santos, C. V. B. and Silva, R. P. E. and Alves, L. C. and de Carvalho, G. A. and Ramos, R. A. N.",,,,,,,,,
Lisi,2014,"Lisi, O. and D'Urso, V. and Vaccalluzzo, V. and Bongiorno, G. and Khoury, C. and Severini, F. and Di Muccio, T. and Gramiccia, M. and Gradoni, L. and Maroli, M.",,,,,,,,,
Lisulo,2014,"Lisulo, M. and Sugimoto, C. and Kajino, K. and Hayashida, K. and Mudenda, M. and Moonga, L. and Ndebe, J. and Nzala, S. and Namangala, B.",,,,,,,,,
Liyanagunawardena,2016,"Liyanagunawardena, N. and Sivakumar, T. and Kothalawala, H. and Silva, S. S. P. and Battsetseg, B. and Lan, D. T. B. and Inoue, N. and Igarashi, I. and Yokoyama, N.",,,,,,,,,
Lledo,2015,"Lledo, L. and Gimenez-Pardo, C. and Saz, J. V. and Serrano, J. L.",,,,,,,,,
Llorens-Picher,2017,"Llorens-Picher, M. and Higes, M. and Martin-Hern and ez, R. and De la Rua, P. and Munoz, I. and Aidoo, K. and Bempong, E. O. and Polkuraf, F. and Meana, A.",,,,,,,,,
Lopes,2017,"Lopes, A. P. and Oliveira, A. C. and Granada, S. and Rodrigues, F. T. and Papadopoulos, E. and Schallig, H. and Dubey, J. P. and Cardoso, L.",,,,,,,,,
Lopes,2013,"Lopes, A. P. and Sousa, S. and Dubey, J. P. and Ribeiro, A. J. and Silvestre, R. and Cotovio, M. and Schallig, Hdfh and Cardoso, L. and Cordeiro-da-Silva, A.",,,,,,,,,
Lopes,Na,"Lopes, J. V. and Michalsky, E. M. and Pereira, N. C. L. and de Paula, A. J. V. and Lara-Silva, F. O. and Silva-Lana, R. and Fortes-Dias, C. L. and Pinheiro, L. C. and Dias, E. S.",,,,,,,,,
Lopes,2014,"Lopes, P. M. and Sorte, E. D. B. and Gasparetto, N. D. and Oliveira, C. M. and de Almeida, Adpf and Sousa, V. R. F.",,,,,,,,,
Lopez,2013,"Lopez, J. and Wey, T. W. and Blumstein, D. T.",,,,,,,,,
Lopez-Cespedes,2013,"Lopez-Cespedes, A. and Longoni, S. S. and Sauri-Arceo, C. H. and Rodriguez-Vivas, R. I. and Villegas, N. and Escobedo-Ortegon, J. and Barrera-Perez, M. A. and Sanchez-Moreno, M. and Gonzalez, M. E. B. and Marin, C.",,,,,,,,,
Lopez-Cespedes,2012,"Lopez-Cespedes, A. and Longoni, S. S. and Sauri-Arceo, C. H. and Sanchez-Moreno, M. and Rodriguez-Vivas, R. I. and Escobedo-Ortegon, F. J. and Barrera-Perez, M. A. and Bolio-Gonzalez, M. E. and Marin, C.",,,,,,,,,
Machila,2001,"Machila, N. and Sinyangwe, L. and Mubanga, J. and Hopkins, J. S. and Robinson, T. and Eisler, M. C.",,,,,,,,,
Maeda,2012,"Maeda, M. H. and Knox, M. B. and Gurgel-Goncalves, R.",,,,,,,,,
Maffey,2012,"Maffey, L. and Cardinal, M. V. and Ordonez-Krasnowski, P. C. and Lanati, L. A. and Lauricella, M. A. and Schijman, A. G. and Gurtler, R. E.",,,,,,,,,
Magallon-Gastelum,2006,"Magallon-Gastelum, E. and Lozano-Kasten, F. and Gutierrez, M. S. and Flores-Perez, A. and Sanchez, B. and Espinoza, B. and Bosseno, M. F. and Breniere, S. F.",,,,,,,,,
Maganga,2017,"Maganga, G. D. and Mavoungou, J. F. and N'Dilimabaka, N. and Kinga, I. C. M. and Mve-Ondo, B. and Mombo, I. M. and Ngoubangoye, B. and Cossic, B. and Okouyi, C. S. M. and Souza, A. and Leroy, E. M. and Kumulungui, B. and Ollomo, B.",,,,,,,,,
Magona,2002,"Magona, J. W. and Mayende, J. S. P. and Walubengo, J.",,,,,,,,,
Maharana,2019,"Maharana, B. R. and Kumar, B. and Joseph, J. P. and Patb and ha, T. K.",,,,,,,,,
Maharana,Na,"Maharana, B. R. and Kumar, B. and Prasad, A. and Patb and ha, T. K. and Sudhakar, N. R. and Joseph, J. P. and Patel, B. R.",,,,,,,,,
Maharjan,2006,"Maharjan, M. and Mishra, D. R. and Blouin, E. F. and Maillard, J. C.",,,,,,,,,
Mahmoudv and ,2011,"Mahmoudv and , H. and Mohebali, M. and Sharifi, I. and Keshavarz, H. and Hajjarani, H. and Akhoundi, B. and Jahanbakhsh, S. and Zarean, M. and Javadi, A.",,,,,,,,,
Maia,2016,"Maia, C. and Altet, L. and Serrano, L. and Cristovao, J. M. and Tabar, M. D. and Francino, O. and Cardoso, L. and Campino, L. and Roura, X.",,,,,,,,,
Maia,2015,"Maia, C. and Coimbra, M. and Ramos, C. and Cristovao, J. M. and Cardoso, L. and Campino, L.",,,,,,,,,
Maia,2010,"Maia, C. and Gomes, J. and Cristovao, J. and Nunes, M. and Martins, A. and Rebelo, E. and Campino, L.",,,,,,,,,
Maia,2014,"Maia, C. and Ramos, C. and Coimbra, M. and Bastos, F. and Martins, A. and Pinto, P. and Nunes, M. and Vieira, M. L. and Cardoso, L. and Campino, L.",,,,,,,,,
Maia,2015,"Maia, C. and Ramos, C. and Coimbra, M. and Cardoso, L. and Campino, L.",,,,,,,,,
Majekodunmi,2013,"Majekodunmi, A. O. and Fajinmi, A. and Dongkum, C. and Picozzi, K. and Thrusfield, M. V. and Welburn, S. C.",,,,,,,,,
Malele,2011,"Malele, II and Magwisha, H. B. and Nyingilili, H. S. and Mamiro, K. A. and Rukambile, E. J. and Daffa, J. W. and Lyaruu, E. A. and Kapange, L. A. and Kasilagila, G. K. and Lwitiko, N. K. and Msami, H. M. and Kimbita, E. N.",,,,,,,,,
Malele,2003,"Malele, I. and Craske, L. and Knight, C. and Ferris, V. and Njiru, Z. and Hamilton, P. and Lehane, S. and Lehane, M. and Gibson, W.",,,,,,,,,
Malfi,2014,"Malfi, R. L. and Roulston, T. H.",,,,,,,,,
Maloney,2010,"Maloney, J. and Newsome, A. and Huang, J. J. and Kirby, J. and Kranz, M. and Wateska, A. and Dunlap, B. and Yabsley, M. J. and Dunn, J. R. and Jones, T. F. and Moncayo, A. C.",,,,,,,,,
Maloo,2001,"Maloo, S. H. and Thorpe, W. and Kioo, G. and Ngumi, P. and Rowl and s, G. J. and Perry, B. D.",,,,,,,,,
Mamoudou,2016,"Mamoudou, A. and Njanloga, A. and Hayatou, A. and Suh, P. F. and Achukwi, M. D.",,,,,,,,,
Mamoudou,2006,"Mamoudou, A. and Zoli, A. and Mbahin, N. and Tanenbe, C. and Bourdanne and Clausen, P. H. and Marcotty, T. and Van den Bossche, P. and Geerts, S.",,,,,,,,,
Mancianti,1994,"Mancianti, F. and Mignone, W. and Galastri, F.",,,,,,,,,
Manlik,2017,"Manlik, O. and Schmid-Hempel, R. and Schmid-Hempel, P.",,,,,,,,,
Manzillo,2018,"Manzillo, V. F. and Gizzarelli, M. and Vitale, F. and Montagnaro, S. and Torina, A. and Sotera, S. and Oliva, G.",,,,,,,,,
Marcelino,2011,"Marcelino, A. P. and Ferreira, E. C. and Avendanha, J. S. and Costa, C. F. and Chiarelli, D. and Almeida, G. and Moreira, E. C. and Leite, R. C. and dos Reis, J. K. P. and Gontijo, C. M. F.",,,,,,,,,
Marenzoni,2018,"Marenzoni, M. L. and Lauzi, S. and Miglio, A. and Coletti, M. and Arbia, A. and Paltrinieri, S. and Antognoni, M. T.",,,,,,,,,
Margonari,2010,"Margonari, C. and Soares, R. P. and Andrade, J. D. and Xavier, D. C. and Saraiva, L. and Fonseca, A. L. and Silva, R. A. and Oliveira, M. E. and Borges, E. C. and Sanguinette, C. C. and Melo, M. N.",,,,,,,,,
Marti,2009,"Marti, G. A. and Echeverria, M. G. and Susevich, M. L. and Becnel, J. J. and Pelizza, S. A. and Garc√≠a, J. J.",,,,,,,,,
Martin-Sanchez,2007,"Martin-Sanchez, J. and Acedo, C. and Munoz-Perez, M. and Pesson, B. and Marchal, O. and Morillas-Marquez, F.",,,,,,,,,
Martin-Sanchez,2006,"Martin-Sanchez, J. and Gallego, M. and Baron, S. and Castillejo, S. and Morillas-Marquez, F.",,,,,,,,,
Martinez-Hern and ez,2014,"Martinez-Hern and ez, F. and Rendon-Franco, E. and Gama-Campillo, L. M. and Villanueva-Garcia, C. and Romero-Valdovinos, M. and Maravilla, P. and Alej and re-Aguilar, R. and Rivas, N. and Cordoba-Aguilar, A. and Munoz-Garcia, C. I. and Villalobos, G.",,,,,,,,,
Martins,2018,"Martins, M. F. D. and Pereira, M. B. and Ferreira, J. D. G. and Franca, A. D. and Cominetti, M. C. and Ferreira, E. D. and Dorval, Memc and Rossi, C. L. and Mazon, S. D. and de Almeida, E. A. and Costa, S. C. B. and Marcon, G. E. B.",,,,,,,,,
Mascolli,2016,"Mascolli, R. and Soto, F. R. M. and Pinheiro, S. R. and Ito, F. H. and Gil, A. and de Azevedo, S. S. and de Lima, V. M. F. and Langoni, H. and Fern and es, A. R. D. and Vasconcellos, S. A.",,,,,,,,,
Masiga,2002,"Masiga, D. K. and Okech, G. and Irungu, P. and Ouma, J. and Wekesa, S. and Ouma, B. and Guya, S. O. and Ndung'u, J. M.",,,,,,,,,
Maslov,2013,"Maslov, D. A. and Votypka, J. and Yurchenko, V. and Lukes, J.",,,,,,,,,
Maslov,2007,"Maslov, D. A. and Westenberger, S. J. and Xu, X. and Campbell, D. A. and Sturm, N. R.",,,,,,,,,
Matete,2003,"Matete, G. O.",,,,,,,,,
Mattioli,2001,"Mattioli, R. C. and Faye, J. A. and Jaitner, J.",,,,,,,,,
